{
  "chapter_index": 15,
  "summary": "董事会会议被韩啸临时改成问责局，试图把陆川定性为“外行乱改、放大风险”，借此推动撤换。陆川以站点止血、商户回流、履约回升的实际数据反击，苏蔓从程序与结果上为其补位。魏岚未支持韩啸立刻换人，而是给陆川七天最后观察期：履约稳定、成本收敛、舆情可控，任一项恶化即启动替换。会后苏蔓指出异常事故像被人精准放大，怀疑有人持续“放火”。随即郑维负责区域爆发大面积错派、骑手事故与热搜舆情，时机与董事会决议高度同步，陆川决定直赴南桥处置并追查调度账号与舆情来源。",
  "new_facts": [
    "韩啸在董事会临时补充《阶段风险追责与授权评估》，将成本异常、试点调整、舆情和授权问题合并为对陆川的问责框架。",
    "陆川在董事会上明确用一线数据证明部分区域已出现止血：城南三个站爆仓峰值回落、赵姐商圈线拒单率下降、骑手流失减半、部分加盟站由退网转为观望。",
    "苏蔓在董事会上指出临时管理授权下的应急调整并非完全无程序依据，并强调应判断波动换来的修复是否有持续价值。",
    "魏岚承认站点止血、商户流失放缓和履约曲线回升属实，但同时认定异常成本、舆情和试点波动也属实。",
    "魏岚作出董事会书面决定：陆川保留临时董事长职务，进入七天最后观察期，考核三项为核心区域履约稳定、异常成本收敛、舆情风险可控，任一项恶化即启动替换程序。",
    "韩啸未能在本次董事会直接撤掉陆川，但已推动正式替换程序具备触发条件。",
    "苏蔓提出关键判断：近期异常并非单纯系统烂，而像有人在陆川刚取得阶段效果时精准放大事故。",
    "陆川与苏蔓都将怀疑初步指向郑维负责片区，但目前还缺数据链、调度痕迹和赔付流向等证据。",
    "董事会决议发出约二十分钟后，郑维负责区域南桥、丰泽、沿河三片区出现大面积错派，路径权重异常跳变，骑手被跨区拉单并发生连环事故。",
    "事故同时引发用户投诉冲热搜，舆情标题直接指向“临时董事长外行乱改调度”，显示外部传播准备极快。",
    "何小满发现错派单的赔付预估流向高度集中，像被刻意堆向几个高投诉商户以放大损失和舆情效果。",
    "郑维在电话中将事故解释为制度切换磨合、晚高峰波峰和可能的调度员操作失误，并建议先发公告安抚、避免再次临时调整。",
    "陆川下令改道南桥现场处置，冻结所有跨区异常单复核，优先救治摔车骑手，赔付不得先由站点垫付，并要求何小满锁定错派路径、时间点和调度账号。"
  ],
  "character_state_changes": [
    {
      "character": "陆川",
      "change": "从准备汇报阶段成果转为被董事会问责对象，保住职位但进入七天最后观察期，明确意识到自己可能被正式撤换，并开始主动追查内部人为放大事故的黑手。"
    },
    {
      "character": "苏蔓",
      "change": "从会前战术提醒转为董事会上公开为陆川提供程序与结果层面的支持，会后进一步提出存在人为“放火”的判断，成为追查内鬼的重要同盟。"
    },
    {
      "character": "魏岚",
      "change": "明确表态自己不看苦劳，只看修复履约是否比拆卖资产更值钱；暂不支持立即换掉陆川，但以冷酷的价值评估方式给出七天窗口。"
    },
    {
      "character": "韩啸",
      "change": "正式将对陆川的攻击从日常掣肘升级为董事会层面的定性问责与替换建议，虽然当场未得手，但已把陆川推入程序化撤换边缘。"
    },
    {
      "character": "郑维",
      "change": "由可疑片区负责人升级为陆川和苏蔓重点怀疑对象，其负责区域在关键时点爆发系统性异常，使其嫌疑显著上升。"
    },
    {
      "character": "何小满",
      "change": "在紧急事故中承担一线数据与排查角色，提供路径权重异常和赔付流向集中的关键线索。"
    }
  ],
  "relationship_changes": [
    "陆川与韩啸的冲突由暗中角力升级为董事会层面的公开权力斗争，目标已从辩论方案变成争夺陆川去留。",
    "陆川与苏蔓的协作关系进一步加深，苏蔓不仅在会上帮他翻译和支撑，也在会后与他共享对郑维的怀疑。",
    "陆川与魏岚形成一种附条件的临时契约关系：魏岚不给情面，但给七天窗口，要求陆川证明修复价值高于拆卖价值。",
    "魏岚与韩啸出现分歧：她不接受韩啸立刻找人背锅式的替换节奏，压下了其当场换人的提议。",
    "陆川对郑维由不完全信任转为明确怀疑其片区异常可能带有人为操纵成分。"
  ],
  "foreshadowing_updates": [
    {
      "id": "board_seven_day_observation",
      "status": "new",
      "note": "陆川获得七天最后观察期，三项考核任一恶化即被启动替换程序，这是下一阶段主线倒计时。"
    },
    {
      "id": "internal_saboteur_targeting_luchuan",
      "status": "new",
      "note": "苏蔓与陆川判断有人在陆川每次刚取得效果时精准制造并放大事故，存在内部持续“放火”者。"
    },
    {
      "id": "zhengwei_suspicion",
      "status": "new",
      "note": "郑维负责区域在董事会决议后迅速爆雷，且其解释过于顺滑，成为目前最直接的怀疑对象。"
    },
    {
      "id": "public_opinion_prepared_in_advance",
      "status": "new",
      "note": "事故与热搜文案几乎同步出现，说明舆情可能被提前准备，后续需查是谁提前布局标题与传播。"
    },
    {
      "id": "asset_sale_vs_operation_repair",
      "status": "new",
      "note": "魏岚把核心问题明确为“修复履约是否比拆卖资产更值钱”，后续公司战略可能在修复与拆卖之间作决断。"
    }
  ],
  "location_or_org_changes": [
    "董事会已形成书面决议，迅城达进入对临时董事长陆川的七天观察期治理状态。",
    "公司内部对陆川的风险认定被正式程序化：履约、成本、舆情三项成为接下来最关键的考核指标。",
    "郑维负责的南桥、丰泽、沿河三片区发生大面积错派与骑手事故，成为新的核心危机区域。",
    "公司舆情环境急剧恶化，相关负面话题已开始冲上热搜，并直接把责任指向陆川的调度改革。",
    "陆川已下令冻结跨区异常单复核，并要求总部先垫付伤者医药费用，不得先把赔付压给站点。"
  ],
  "must_remember_next": [
    "陆川现在只有七天观察期，考核指标是履约稳定、成本收敛、舆情可控，任何一项继续恶化都可能被撤换。",
    "韩啸已经把对陆川的攻击升级为正式替换程序预备，后续仍会抓住任何新事故推进换人。",
    "魏岚暂时保留陆川不是出于信任，而是等待价值验证；她随时可能转向支持拆卖资产或换人。",
    "苏蔓与陆川已形成共识：近期事故很可能有人为放大，不只是自然混乱。",
    "郑维是当前最重要嫌疑人，但还没有证据，必须继续追数据链、调度痕迹、赔付流向和舆情来源。",
    "南桥、丰泽、沿河三片区刚爆发错派、骑手事故和舆情危机，陆川正直接赶往南桥现场。",
    "何小满掌握关键排查任务：锁定错派路径、发生时间点、调度账号，以及赔付异常集中流向。",
    "陆川坚持处理原则：先保骑手与一线，不允许再把赔付先压给站点和骑手，这会影响后续所有处置决策。"
  ]
}