{
  "chapter_index": 9,
  "summary": "午高峰爆单时，陆川在站点发现骑手不愿接单核心原因是异常责任和扣罚乱压到个人头上。他推动站长、苏蔓、何小满、老周临时建立四类异常人工豁免和限定补贴机制，并按商圈重排线路、回拨重点商户、亲自去安抚赵姐，成功止住站点履约恶化，恢复部分骑手和商户信任。午高峰刚稳住，网上却出现偷拍视频，把他的现场救火剪成“董事长作秀失败”热搜，且视频含有不应外泄的内部调度信息，暗示站内或内部链路存在泄密者。",
  "new_facts": [
    "站点午高峰爆单的核心矛盾不是单价低，而是骑手担心因商户出餐慢、系统跨区远派、道路绕行、爆仓改派等异常被错误扣罚，导致越跑越亏。",
    "陆川现场确定四类异常先人工登记、班次后复核，午高峰期间暂不计入骑手个人扣罚。",
    "苏蔓提供了临时授权留痕：仅限当前时段的异常豁免与限定补贴，事后复核，不构成长期政策。",
    "站点临时补贴只开放三类：远单补位、临时跨区支援、超长等待单；每单封顶、实名登记、限定午高峰时段。",
    "陆川要求客服建立重点商户回拨清单，对头部商户和连续催单商户给出明确到店/送达时间与责任说明。",
    "陆川亲自到赵姐门店，提出站点挂账、异常豁免、不让骑手背锅，并以本轮结果争取其暂不切换到竞争平台“闪奔到家”。",
    "经过人工调度和止血措施，站点履约率回升两个点，待派时长下降，重点商户投诉量从两位数降到个位数。",
    "骑手重新接单的关键不是口号，而是确认异常有人认、扣罚不乱压、补贴规则清楚。",
    "网上出现热搜“#迅城达董事长亲自送单都救不回烂系统#”，视频把陆川的现场救火剪成负面舆论。",
    "偷拍视频中拍到了站点白板临时线路标记和“A三区异常先挂人工池”等内部调度信息，说明泄露者或供素材者熟悉现场业务。"
  ],
  "character_state_changes": [
    {
      "character": "陆川",
      "change": "从单纯现场救火转为既稳住午高峰履约、骑手和商户信任，又开始警觉并追查内部信息外泄与舆论攻击。"
    },
    {
      "character": "老周",
      "change": "由此前观望和口头配合，转为真正认可陆川能在一线扛事，并主动带头跑高风险补位单。"
    },
    {
      "character": "何小满",
      "change": "承担起异常单拉取、豁免截图公示、商户回拨清单等执行工作，成为陆川现场方案的关键支持者。"
    },
    {
      "character": "苏蔓",
      "change": "从强调合规风险转为快速配合陆川的临时止血方案，并在舆情出现后第一时间提醒保存证据、圈定知情人。"
    },
    {
      "character": "站长",
      "change": "从担心越权背锅转为接受与陆川共同承担临时豁免和补贴决策。"
    },
    {
      "character": "赵姐",
      "change": "从强烈不满、准备切换平台，转为暂时观望，以本次午高峰结果决定是否继续合作。"
    },
    {
      "character": "站点骑手群体",
      "change": "从因惧怕异常扣罚而不愿接单，转为在看到豁免留痕和明确规则后恢复部分接单意愿。"
    }
  ],
  "relationship_changes": [
    "陆川与老周的关系明显升温，老周开始把他视为真正能扛现场的人，而不只是“陆董”。",
    "陆川与站长从冲突式沟通转为共同担责的临时同盟。",
    "陆川与苏蔓形成更直接的协作关系：陆川负责现场决断，苏蔓负责授权留痕和后续风控应对。",
    "陆川与骑手群体的信任有所修复，前提是他承诺并公开承担异常翻账责任。",
    "陆川与赵姐的关系从濒临破裂转为脆弱缓和，赵姐暂缓切平台但仍只认结果。",
    "迅城达站点与竞争对手“闪奔到家”的抢人、抢商户压力被明确摆到台前。"
  ],
  "foreshadowing_updates": [
    {
      "id": "internal_leak_and_smear_campaign",
      "status": "new",
      "note": "热搜视频含内部调度信息，疑似有人提前向本地号喂素材，后续需追查泄密者或幕后操盘者。"
    },
    {
      "id": "temporary_exception_waiver_policy_risk",
      "status": "new",
      "note": "四类异常人工豁免和限定补贴虽暂时救场，但只是临时措施，后续可能面临财务、运营、合规复核压力。"
    },
    {
      "id": "zhao_jie_cooperation_crisis",
      "status": "advanced",
      "note": "赵姐本章暂未切换平台，但明确只看今天中午结果，合作关系仍不稳。"
    },
    {
      "id": "frontline_trust_rebuilding",
      "status": "advanced",
      "note": "陆川通过担责和透明规则暂时修复了一线骑手信任，这种信任能否延续取决于后续总部是否翻账。"
    }
  ],
  "location_or_org_changes": [
    "站点在午高峰临时建立了异常人工池、登记表、补贴池和重点商户回拨机制，形成一套非系统化但可追溯的救火流程。",
    "站点调度方式从系统均分改为人工按商圈、近远单、出餐状态重排线路。",
    "迅城达在该站点的一线履约数据短期止血：履约率回升、待派时长下降、重点商户投诉减少。",
    "站点内部信息安全出现风险，说明组织内可能存在泄密环节或被外部渗透的薄弱点。",
    "竞争平台“闪奔到家”正在巷口挖骑手，并以更高单价和更少扣罚作为竞争话术。"
  ],
  "must_remember_next": [
    "四类异常豁免：商户出餐超时、系统跨区远派、道路临时绕行、午高峰人工报备异常；当前仅是人工登记和班次后复核的临时规则。",
    "临时补贴仅限远单补位、临时跨区支援、超长等待单，且有封顶、实名、限定时段和审批留痕。",
    "陆川已公开承诺：午高峰这批异常若总部翻账，由他去对；这关系到骑手是否继续信任他。",
    "赵姐只是暂时不切平台，后续仍可能因结果不稳转投‘闪奔到家’。",
    "热搜负面视频不是普通路人随手拍，泄露了内部调度口令和白板信息，必须追查接触现场调度信息的人名单。",
    "苏蔓已提醒先保存原视频和传播链路，后续舆情与内鬼调查会成为下一章核心矛盾。",
    "午高峰虽然救回，但靠的是人工担责垫住烂规则，系统性问题并未解决。"
  ]
}