{
  "chapter_index": 11,
  "summary": "陆川在站点核查异常派单，确认系统并非随机故障，而是被人为调整为“平均分配、报表平滑”导向，导致近骑手接不到单、热点区被拖慢、冷区空转、商户超时加剧。何小满承认后台早知风险，韩啸要求以“阶段性波动”统一口径并限制排查。苏蔓提出必须走书面留档和合规调阅流程。三人调取版本与审批记录后发现，该策略变更走了正式流程，且最终签批人为郑维，系统线与内鬼线正式接上。",
  "new_facts": [
    "当前调度异常的核心表现是系统故意绕开近骑手，把订单派给更远或不顺路的人。",
    "异常派单并非站点层面可调整的问题，而是底层调度策略被改动。",
    "调度策略从“效率优先”被改成更偏“运力均衡、区域平滑、报表稳定”。",
    "这一策略会导致热点区响应变慢、冷区运力被硬摊、真实履约变差、商户投诉和赔付上升。",
    "技术侧何小满此前已提出过风险，但被以“不要制造技术恐慌”“董事会怕系统背锅”为由压下。",
    "韩啸要求对外继续使用“局部高峰、运力磨合、阶段性波动”的统一口径，并限制技术侧大规模复盘。",
    "苏蔓提出必须通过正式合规流程调阅历史版本、参数变更、审批日志和异常投诉时间线，形成书面记录。",
    "何小满、陆川、苏蔓组成临时调查协作，开始正式追查参数变更来源。",
    "系统版本库显示该策略调整不是私下热修，而是走了正式申请、评审、灰度和签批流程。",
    "审批备注明确目标是提升区域负载均衡表现、降低局部峰值波动、提升报表稳定性。",
    "风险确认中已知晓该改动会影响热点响应和投诉情况，说明签批者并非不知情。",
    "最终签批人是郑维，表明异常系统策略与高层决策直接相关。"
  ],
  "character_state_changes": [
    {
      "character": "陆川",
      "change": "从怀疑系统异常升级为确认有人故意改坏系统，并决定不再靠口头争执，而是以留档和签字链追责。"
    },
    {
      "character": "何小满",
      "change": "从防御和畏惧背锅，转为在陆川承诺承担前线压力后同意协助调查。"
    },
    {
      "character": "苏蔓",
      "change": "明确成为调查推进者，以合规、留痕、书面记录方式把冲突转入可追责流程。"
    },
    {
      "character": "韩啸",
      "change": "立场明确偏向稳住局面和控制排查范围，试图压制系统问题升级为高层责任。"
    },
    {
      "character": "郑维",
      "change": "虽未出场，但身份从潜在线索对象升级为已确认的策略变更最终签批人。"
    }
  ],
  "relationship_changes": [
    "陆川与何小满从对立质问转为建立初步互信和合作关系。",
    "陆川与苏蔓形成更明确的并肩调查关系：陆川负责一线证据，苏蔓负责流程与合规。",
    "陆川与韩啸的冲突公开化，双方在“稳定口径”与“追查真相”上立场对立。",
    "何小满对苏蔓的专业路径产生依赖，技术调查开始依附法务/合规流程推进。",
    "陆川与郑维的潜在对抗正式成立，目标从查故障转向查签批责任人。"
  ],
  "foreshadowing_updates": [
    {
      "id": "system_tampering_mastermind",
      "status": "resolved",
      "note": "系统异常并非自然故障，已查明是正式流程下的人为策略调整，最终签批人为郑维。"
    },
    {
      "id": "coverup_by_stability_narrative",
      "status": "advanced",
      "note": "韩啸继续推动“阶段性波动”统一口径，并限制复盘，说明公司内部存在系统性遮掩。"
    },
    {
      "id": "tech_and_frontline_alliance",
      "status": "advanced",
      "note": "陆川、何小满、苏蔓三方首次真正联手，后续可能共同对抗高层决策链。"
    },
    {
      "id": "evidence_chain_vs_power_chain",
      "status": "new",
      "note": "后续关键不再是证明系统有问题，而是拿到完整的申请、审批、执行和风险确认链条。"
    }
  ],
  "location_or_org_changes": [
    "核心商圈站点表面止血，但实际调度问题仍持续存在。",
    "公司调度后台确认存在正式上线的策略变更，组织层面不是局部失误而是制度化决策结果。",
    "董事会当前高度忌惮系统再背锅，导致内部倾向压制排查和统一对外话术。",
    "法务/合规路径被启用，版本记录、变更单、审批日志开始成为内部调查工具。"
  ],
  "must_remember_next": [
    "郑维是调度策略变更的最终签批人，这一事实已被系统记录确认。",
    "问题本质是高层为了报表稳定牺牲真实履约效率，不是单纯技术故障。",
    "韩啸主张控制排查范围、统一口径，后续可能阻挠调查或监控调查痕迹。",
    "调查必须依赖正式留痕：历史版本、变更单、审批日志、风险评估、投诉时间线。",
    "何小满已上船但仍有顾虑，陆川承诺承担正面压力，这是维持合作的关键。",
    "系统线与内鬼线已经并线，后续冲突对象将从抽象问题转向具体签批责任链。"
  ]
}