{
  "chapter_index": 2,
  "summary": "陆川被凭程振山留下的书面临时授权推入董事会，临时主持公司事务，但权限受限，重大资产、融资、股权事项不能单独决定。他坚持将“历史经营责任不自动归己”写入纪要后，正式坐上主席位。会上他逼管理层说人话，揭出超时率12.7%、有效投诉1346、商户投诉621、逾期站点款387万、骑手两周净流失9.4%、17个头部商户预警等实情。随后加急预警再爆：核心商圈超时破警戒线，多站点催款、骑手补贴延迟，东三环站压单467票，部分站长放话今晚停运，陆川一上位即直面全面危机。",
  "new_facts": [
    "程振山在事故前签署了带签名、公司章和见证流程的书面临时授权及应急主持意见，程序上短期有效。",
    "陆川可临时主持董事会并代行部分董事长职权，但无权单独决定重大资产处置、融资、股权事项。",
    "陆川要求并获得同意：会议纪要需写明临时授权边界，历史经营责任不自动算到他头上。",
    "陆川正式落座主席位，身份从局外人变为临时主持者。",
    "公司经营危机数据曝光：昨日午高峰东三区超时率12.7%。",
    "公司当日有效投诉1346件，其中商户端投诉621件。",
    "截至昨日，逾期未结算站点款为387万元。",
    "近两周骑手净流失9.4%。",
    "核心区域若继续恶化，已有17个头部商户进入预警名单，其中6个为年框客户。",
    "加急预警显示：核心商圈午高峰超时率进一步上冲并突破警戒线。",
    "赵氏餐饮、鲜立达、邻里仓三家头部商户集中投诉，要求两小时内负责人回电。",
    "东三区、南河、北城路等多个站点催讨上周垫付赔款，最晚今晚6点，逾期将暂停接单。",
    "东三环站骑手压单467票。",
    "北城路站申请今晚8点后暂停出车，理由是连续三周赔付未清。"
  ],
  "character_state_changes": [
    {
      "character": "陆川",
      "change": "从抗拒被推上台的外部人，变为实际落座的临时董事会主持者，并迅速意识到自己被当作挡雷者。"
    },
    {
      "character": "陆川",
      "change": "在会议中展现出追问核心运营数据、强调留痕和责任边界的应对方式。"
    },
    {
      "character": "苏蔓",
      "change": "明确站在程序执行与风险切割位置上，持续提醒陆川授权边界与历史责任归属。"
    },
    {
      "character": "韩啸",
      "change": "继续以维护程序和稳定口径的姿态主导局面，但其倾向于让陆川承接前台风险更加明显。"
    },
    {
      "character": "魏岚",
      "change": "从旁观评估转为认可陆川提出的责任边界要求，并以更高标准审视其接火能力。"
    }
  ],
  "relationship_changes": [
    "陆川与苏蔓形成一种带防备的临时协作关系：她推动他上位，同时也提示他如何防止背锅。",
    "陆川与韩啸的对立加深：陆川看穿韩啸以程序和稳定名义转嫁风险。",
    "魏岚对陆川的态度从单纯审视转为观察其是否能接住第一波危机。",
    "管理层对陆川的轻视有所收敛，开始意识到他会抓数据、会留字据。"
  ],
  "foreshadowing_updates": [
    {
      "id": "temp_authority_limited",
      "status": "new",
      "note": "陆川虽坐上临时董事长位置，但权限受限，后续重大决策必将引发权力冲突。"
    },
    {
      "id": "historical_liability_shift",
      "status": "new",
      "note": "陆川坚持把历史经营责任切割写入纪要，后续很可能围绕责任归属发生争斗。"
    },
    {
      "id": "station_shutdown_crisis",
      "status": "new",
      "note": "多个站点催款并威胁停运，北城路站已申请今晚暂停出车，下一章可能爆发履约中断。"
    },
    {
      "id": "merchant_contract_risk",
      "status": "new",
      "note": "17个头部商户进入预警，6个为年框客户，后续可能出现解约、赔付或舆情升级。"
    },
    {
      "id": "han_xiao_hidden_agenda",
      "status": "new",
      "note": "韩啸不断强调统一口径和稳定预期，显示其更在意控场与风险转移，后续可能与陆川正面博弈。"
    }
  ],
  "location_or_org_changes": [
    "公司董事会在程序上完成了由陆川临时主持的安排。",
    "公司当前处于经营失稳边缘：履约超时上升、商户投诉集中、站点欠款严重、骑手补贴延迟。",
    "核心商圈超时率已破警戒线，组织已从内部承压进入外部可感知危机阶段。",
    "多个站点出现暂停接单或停运威胁，公司履约网络面临即时断裂风险。"
  ],
  "must_remember_next": [
    "陆川的身份是基于程振山书面授权的临时主持者，不是正式全面接管者。",
    "纪要必须写明：历史经营责任不自动归陆川，这是后续追责与博弈关键。",
    "当前最紧急矛盾是站点欠款与停运威胁，其次是头部商户集中投诉。",
    "关键危机数据必须记住：超时率12.7%、投诉1346、商户投诉621、逾期站点款387万、骑手净流失9.4%、17个商户预警、6个年框客户、东三环压单467票。",
    "今晚6点是多个站点催款暂停接单节点，今晚8点后北城路站可能暂停出车。",
    "韩啸主张先稳口径，陆川则倾向先解决履约和欠款，双方路线冲突已经形成。"
  ]
}