{
  "chapter_index": 20,
  "summary": "陆川在危机后把重点从公关转向履约修复：核心商户白名单、红区人工兜底、赔付不再甩锅骑手。赵姐代表七家高频商户只给迅城达三天观察期，恢复部分单量。陆川又去站点向老周等说明新规，争取到一线暂时站队。董事会最终同意三天内不拆分一线指挥权。苏蔓拿出程振山旧备忘，证明其当年有意选择陆川，并在会后交给他第二层文件，内含补充授权和一份涉及公司早期路线分歧的名单。",
  "new_facts": [
    "迅城达临时执行的稳盘方案包括：核心商户前二十专人盯防、红区订单进入人工池、客服优先回商户、系统锅和调度锅不得再扣骑手。",
    "何小满提出并上线临时白名单与人工兜底机制，站长可手动拦截爆单、漂单、跨区异常并重派，系统留痕且不算违规干预。",
    "苏蔓将稳盘措施写成书面执行令，并设置总部专项赔付池，禁止站点擅自将赔付二次转嫁给骑手。",
    "赵姐代表七家高频商户与迅城达签下三天观察期协议，只恢复部分单量，条件是履约准点、赔付统一、客服十分钟内响应；若再炸一次将切平台。",
    "赵姐门店的异常升级、赔付与对账规则已落书面：24小时对账回执、异常单先行垫付、指定联络人失联超十分钟视为总部违约响应。",
    "陆川向站点和骑手承诺并当场生效的新规：异常单先复核再扣、系统误派免责、赔付分摊重算、客服回执同步站长。",
    "董事会收到的阶段性结果包括：高密度站点出勤率回升至86%，爆单区域压回3处，客服积压从1327件降到409件。",
    "魏岚同意现阶段不拆分执行权，给予陆川三天按预案运行的窗口，董事会暂不干预一线指挥。",
    "韩啸表面表示配合流程衔接，但陆川和苏蔓都判断其只是暂时收手，后续仍会寻找机会收权或甩锅。",
    "苏蔓出示两年前程振山的旧备忘，批注为“先救履约，再稳人心，最后算成本。陆川处理次序对。记住这个人。”，证明程振山早就看中过陆川的一线处理能力。",
    "陆川明确改变原先想尽快交还董事长位置的想法，决定继续承担董事长职权，至少先不让公司倒。",
    "苏蔓交给陆川程振山留下的第二层文件，内含授权补充及一份名单，记录公司最早一批人中关于‘站点密度与履约优先’和‘平台化轻资产外包’两条路线的分歧。"
  ],
  "character_state_changes": [
    {
      "character": "陆川",
      "change": "从临时灭火转为主动承担董事长职责，明确决定暂不离开，先保公司不倒；同时掌握了更多一线执行权。"
    },
    {
      "character": "苏蔓",
      "change": "从辅助记录与法务包装进一步转为陆川的关键支撑者，用书面规则、责任链和旧备忘帮他稳住董事会，并主动交出程振山留下的深层文件。"
    },
    {
      "character": "赵姐",
      "change": "从强烈不信任转为谨慎给出三天观察期，但仍只恢复部分单量，保持随时切平台的保留态度。"
    },
    {
      "character": "老周",
      "change": "从质疑总部甩锅转为暂时认可陆川个人，愿意按新规则带站点先扛三天。"
    },
    {
      "character": "何小满",
      "change": "技术与调度作用上升，成为人工兜底、白名单和异常重派机制的具体执行负责人之一。"
    },
    {
      "character": "魏岚",
      "change": "从观望止损转为阶段性支持陆川，接受三天内不干预一线指挥，但仍保留止损方案。"
    },
    {
      "character": "韩啸",
      "change": "在董事会中暂时退让，未能收回执行权，但态度并未真正服软。"
    },
    {
      "character": "程振山",
      "change": "虽未出场，但其过往判断被揭示：他选择陆川并非权宜之计，而是基于早年一线事件形成的明确认可，并留下了更深层布局。"
    }
  ],
  "relationship_changes": [
    "陆川与赵姐的关系由对立质询转为带条件的合作，建立了三天观察期的书面约束。",
    "陆川与站长、骑手代表的关系由不信任转为基于规则公平的暂时站队，尤其得到老周公开表态支持。",
    "陆川与苏蔓的协作进一步加深，苏蔓开始把程振山隐藏文件和内部历史路线问题向他开放。",
    "陆川与董事会的关系从被动接受审视转为获得阶段性执行主导权，但只是现实妥协而非真正统一。",
    "陆川与韩啸的权力冲突进一步明确，双方进入暂时停火、后续仍会继续博弈的状态。"
  ],
  "foreshadowing_updates": [
    {
      "id": "three_day_observation_period",
      "status": "new",
      "note": "赵姐代表七家商户给出三天观察期，是否稳住履约将直接决定商户是否继续留在平台。"
    },
    {
      "id": "han_xiao_counterattack",
      "status": "new",
      "note": "韩啸只是暂时收手，后续很可能等待陆川再次失误后重新争夺执行权并甩锅。"
    },
    {
      "id": "cheng_zhenshan_chose_luchuan",
      "status": "new",
      "note": "程振山当年指定陆川并非临时起意，而是基于其早年一线处置能力的长期观察。"
    },
    {
      "id": "second_layer_file_and_name_list",
      "status": "new",
      "note": "程振山留下的第二层文件包含补充授权和一份涉及公司早期路线斗争的名单，预示内鬼事件背后还有更深层的旧账与权力线索。"
    },
    {
      "id": "company_route_conflict",
      "status": "new",
      "note": "公司早期存在‘站点密度与履约优先’和‘平台化轻资产外包到底’两条路线分歧，后续可能牵出当前危机根源与阵营关系。"
    }
  ],
  "location_or_org_changes": [
    "迅城达进入临时稳盘状态，运营重点正式从舆情止血转向履约修复和一线规则重建。",
    "临时指挥室形成统一执行方案：核心商户白名单、红区人工调度、专项赔付池、优先响应商户。",
    "赵姐所代表的七家高频商户没有完全回流，只给予部分单量和三天观察窗口。",
    "高密度站点出勤恢复到86%，爆单区域从更严重状态压缩至3处，客服积压显著下降。",
    "站点获得人工兜底开关和异常拦截重派权限，组织层面对系统自动派单的依赖被阶段性削弱。",
    "董事会暂时不拆一线执行口，形成三天内不干预陆川指挥的阶段性共识。"
  ],
  "must_remember_next": [
    "赵姐和七家高频商户只给三天观察期，且仅恢复部分单量；若再次爆炸会直接切平台。",
    "新规则已书面化：系统误派免责、异常单先复核再扣、赔付不得转嫁骑手、客服十分钟响应商户异常。",
    "何小满负责的白名单和人工兜底机制已上线，站长可以手动拦截重派异常单。",
    "董事会目前三天内不拆分陆川执行权，但魏岚仍保留止损方案，韩啸只是暂时收手。",
    "陆川已明确决定继续承担董事长职责，不再打算立刻把位置还回去。",
    "程振山两年前的批注证明他早已认可陆川的处理能力，这会影响后续对其继任合法性的理解。",
    "苏蔓已拿出程振山的第二层文件，其中有补充授权和一份涉及公司早期路线分歧的名单，下一章大概率会展开这份文件。",
    "内鬼事件不是终点，背后更深层问题可能是公司历史路线斗争与早期核心人物站队。"
  ]
}