{
  "chapter_index": 3,
  "summary": "陆川以临时董事长身份首次主持高管例会，遭遇管理层用术语包装履约危机。汇报中不断强调“可控”“阶段性波动”，却回避具体站点、仓储拥堵、赔付责任和骑手流失问题。陆川凭一线经验识破报表与实时工单的矛盾，直接点出南城仓积单、西河站掉骑手等风险，逼得会议失去包装空间。苏蔓依据章程确认他有权追加现场核查。最终陆川当场要求立刻去仓里、站点和看实时工单，谁不敢去谁就有鬼。",
  "new_facts": [
    "陆川已被正式以“临时董事长”身份安排主持高管例会，程总此前有授权文件支持其身份合法性。",
    "苏蔓在会议中负责程序记录，并确认临时董事长可追加现场核查安排，相关部门必须配合。",
    "公司当前核心危机不是单一舆情，而是履约系统异常：站点稳定性下降、仓储可能积单、升级工单和即时赔付申请上升、赔付责任不清。",
    "管理层在汇报中刻意使用术语弱化问题，避免明确具体责任与风险点。",
    "陆川从实时看板和数据中识别出报表与现场状态不一致，认为总部报表被做得体面，但一线已接近失控。",
    "陆川明确点出南城仓存在大量积单，西河站前一晚出现骑手流失，午高峰承压。",
    "韩啸倾向以流程、专题报告和全局叙事压制对具体点位的追问，阻止现场核查立即发生。",
    "会议结尾陆川中止PPT汇报，要求马上去仓里、站点和查看实时工单进行现场核查。"
  ],
  "character_state_changes": [
    {
      "character": "陆川",
      "change": "从初入会议室的不适应和被动，转为主动掌控会议议程，公开挑战管理层叙事，并决定亲自现场核查。"
    },
    {
      "character": "苏蔓",
      "change": "起初仅以公事公办态度协助陆川，后因其问题直击要害，对其能力判断出现明显改观，并用章程为其行动提供制度支持。"
    },
    {
      "character": "韩啸",
      "change": "从从容控场转为被陆川逼入防守，职业化笑容消失，对陆川产生更明确的对立和警惕。"
    }
  ],
  "relationship_changes": [
    "陆川与韩啸的矛盾公开化：陆川质疑其掩盖问题，韩啸则否定陆川的“现场经验”能代表全局。",
    "苏蔓对陆川的看法从“临时摆设”转向“懂现场后果、可能真正介入管理的人”。",
    "陆川与高管团队之间形成明显不信任，双方语言体系和问题焦点直接冲突。"
  ],
  "foreshadowing_updates": [
    {
      "id": "temp_chairman_vs_management",
      "status": "new",
      "note": "陆川虽有合法身份，但与既有高管层尤其韩啸的治理冲突已爆发，后续将持续对抗。"
    },
    {
      "id": "fulfillment_system_crisis",
      "status": "new",
      "note": "公司真正危机是履约系统性失稳而非单纯舆情，南城仓、西河站等具体点位可能在后续爆雷。"
    },
    {
      "id": "on_site_inspection",
      "status": "new",
      "note": "陆川要求立即去现场核查，下一章大概率进入仓、站点和实时工单的实地验证。"
    },
    {
      "id": "suman_shift",
      "status": "new",
      "note": "苏蔓开始重新评估陆川，后续可能从中立记录者转为有限支持者。"
    }
  ],
  "location_or_org_changes": [
    "公司高管例会确认了陆川作为临时董事长的主持权和程序合法性。",
    "公司组织层面暴露出总部汇报体系与一线履约现实脱节的问题。",
    "南城仓被点名为高风险仓点，可能已有严重积单。",
    "西河站被点名为骑手流失站点，短期履约能力受影响。",
    "会议现场已形成追加现场核查的决定方向，相关部门理论上需配合。"
  ],
  "must_remember_next": [
    "陆川已当众要求立刻去仓里、站点和看实时工单，现场核查是下一章直接承接事项。",
    "南城仓积单、西河站掉骑手是已被明确点名的关键风险点。",
    "韩啸明显反对把问题落到具体点位，后续可能继续拖延、包装或设置程序障碍。",
    "苏蔓已用章程为陆川的核查要求提供合法依据，她的立场出现微妙变化。",
    "核心矛盾不是舆情，而是履约崩压、赔付甩锅、站点透支和报表失真。"
  ]
}