{
  "chapter_index": 16,
  "summary": "陆川在董事会解释会前得知事故片区履约系统失控，骑手、站点、商户同时爆炸。他顶着被董事会定性为“改革失控”的风险，拒绝先去背锅，转而赶赴现场救火：冻结事故时段扣罚、改自动派单为半停、人工拆线短驳、协调商户按热单/非时效单分流，并推动快速减赔白名单。现场秩序被暂时拉回。随后何小满、苏蔓协助调取日志，发现郑维辖区在事故前关键时段存在异常外部连接介入调度权限，且有删除残痕，说明此事可能不只是系统自然崩溃，而有人动过手脚。",
  "new_facts": [
    "董事会和韩啸已将本次事故初步定性为“改革失控”，准备在解释会上让陆川先行说明并承担责任。",
    "事故影响已从舆情升级为真实履约事故：异常改单、重复派发、跨区硬塞单、超时误判、退单、投诉、扣罚同时爆发。",
    "陆川选择缺席或晚到解释会，优先前往事故片区处理一线问题。",
    "陆川在现场口头冻结事故片区当日因系统异常产生的超时扣罚，并表示责任先记在自己身上。",
    "陆川组织站点将自动派单切为半停，改为人工派单，拆长线路为短驳接力，优先保核心商圈和医院线。",
    "商户侧在陆川协调下改为按热单、非时效单、可自提单分流，避免后厨继续无序堆单。",
    "苏蔓现场补做程序留痕，推动建立事故时段快速减赔白名单，限制在可核验订单范围内。",
    "老周从北口站借调五名熟路骑手支援巷子线路。",
    "第二轮人工改派后，核心商圈滞留单开始下降，站点和商户现场秩序暂时恢复到可运转状态。",
    "何小满通过日志排查发现，异常不是全网普遍故障，而是集中发生在郑维管辖片区。",
    "系统参数层面出现跨区拉单阈值调低、优先级被改、超时补派提前触发等异常改动，造成周边运力被错误吸入郑维片区，越救越堵。",
    "备份层中发现事故前关键时段有异常外部连接介入调度权限，且存在被清理过的删除残痕，目标仍指向郑维片区。",
    "目前尚不能直接确认具体操作者，因为前台权限名未必对应真实使用者。"
  ],
  "character_state_changes": [
    {
      "character": "陆川",
      "change": "从被动准备在董事会挨打，转为主动承担现场风险并亲自救火；内心目标从“脱身”转为“掌舵”，明确先对骑手和商户负责。"
    },
    {
      "character": "苏蔓",
      "change": "起初坚持程序和责任边界，后转为实际跟随陆川到现场补程序、留证据，并愿意越线调取备份日志，站到陆川一侧承担风险。"
    },
    {
      "character": "老周",
      "change": "原本主张陆川先保住董事会位置，随后被陆川说服，转而全力参与现场调度和跨站借人。"
    },
    {
      "character": "何小满",
      "change": "从技术排查异常，进一步确认问题可能涉及人为干预，开始进入备份层取证。"
    },
    {
      "character": "韩啸",
      "change": "继续推动陆川先去解释会，立场上更明确地站在董事会定责一边。"
    },
    {
      "character": "赵姐",
      "change": "从愤怒质疑总部、几乎失去合作耐心，转为给陆川半天窗口，暂时压住商户集体撤单。"
    }
  ],
  "relationship_changes": [
    "陆川与韩啸的对立进一步公开化：韩啸强调对董事会负责，陆川明确表示先对一线送单的人负责。",
    "陆川与苏蔓的信任明显加深：苏蔓不再只是程序监督者，而开始替他补程序、留痕并协助取证。",
    "陆川与老周从策略分歧转为并肩救火，老周重新站到陆川执行面一侧。",
    "陆川与骑手、商户的关系改善：他通过冻结扣罚、亲自调度和承担责任，获得一线重新配合与初步认可。",
    "一线人员对陆川的“陆董”称呼含义变化，从头衔和质疑转为认同其实际负责。"
  ],
  "foreshadowing_updates": [
    {
      "id": "board_scapegoat_luchuan",
      "status": "new",
      "note": "董事会已提前形成“改革失控”定性，后续很可能围绕陆川展开正式问责或罢免。"
    },
    {
      "id": "zhengwei_area_suspicious_manipulation",
      "status": "new",
      "note": "郑维辖区被发现存在集中参数异常与外部连接痕迹，指向可能的人为做局。"
    },
    {
      "id": "log_deletion_trace_evidence",
      "status": "new",
      "note": "备份层发现被清理未净的删除残痕，后续可作为追查幕后操作者的重要证据。"
    },
    {
      "id": "suman_crossing_line",
      "status": "new",
      "note": "苏蔓明确表示调阅备份层属于越线，她已实质卷入陆川阵营，后续将承担程序与职业风险。"
    },
    {
      "id": "luchuan_leadership_rise",
      "status": "new",
      "note": "陆川在一线完成救火并获得基层认人，后续其领导权可能从名义转向真实凝聚。"
    }
  ],
  "location_or_org_changes": [
    "总部临时会议室已成为针对陆川的定责场域，外部媒体也在等待公司口径。",
    "事故片区站点从失控状态进入人工调度状态：自动派单半停、线路重拆、核心商圈优先保障。",
    "商户侧由接近集体撤单转为暂时接受半天缓冲，并开始按临时规则配合出餐分流。",
    "站点仓库后方临时搭建后台排查点，用于现场调取系统参数和备份日志。",
    "郑维管辖片区被确认是本次异常的集中爆发区和调查核心区域。"
  ],
  "must_remember_next": [
    "陆川缺席/晚到董事会解释会，已经给了对手正式追责他的把柄。",
    "陆川曾当众口头冻结事故片区系统异常扣罚，后续必须补备案，否则会被财务、人资和程序层面追责。",
    "现场救火已初见成效：核心商圈滞留下降，商户暂缓撤单，骑手愿意继续顶高峰。",
    "郑维片区是异常核心，日志显示参数被改动且有异常外部连接和删除残痕。",
    "现阶段只能证明存在可疑人为干预迹象，尚未锁定具体操作者，不能贸然定人。",
    "苏蔓已越线协助调取备份和留证，后续她的立场、风险和作用会很关键。",
    "韩啸与董事会已经在责任叙事上先行一步，后续很可能借陆川擅离解释会继续发难。",
    "陆川本章完成了从求自保到主动掌舵的心理转变，这会影响他后续的决策方式。"
  ]
}