{
  "chapter_index": 1,
  "summary": "骑手陆川在午高峰跑单时接到一份送往迅城达总部顶层秘书处的加急文件。到达后，他发现总部气氛异常，得知创始人程振山突发昏迷。法务兼董秘苏蔓确认，程振山昏迷前点名要见陆川，并留下文件要求在董事会当场宣读。董事会会议上，文件内容公开：在程振山因健康原因暂时无法履职期间，指定陆川临时代理董事长职责。此决定震动全场，陆川本人也完全不知情，只想知道程振山为何偏偏选他。",
  "new_facts": [
    "陆川是迅城达同城骑手，工号06721，当前经济压力较大，家中有旧债，跑单目标包括月底往家里打钱。",
    "陆川在第1章接到一单加急同城文件件，收件地址为迅城达总部顶层秘书处，要求必须本人送达，不得转交前台。",
    "迅城达总部当日处于异常状态，普通员工电梯权限被临时限制，公司高层正在压消息。",
    "迅城达创始人兼董事长程振山突发昏迷，现场有医生和秘书处人员在场。",
    "法务兼董秘苏蔓负责处理程振山昏迷后的程序事务，并亲自带陆川上楼。",
    "程振山在昏迷前最后记录中明确提到“把陆川留下，文件交董事会”。",
    "程振山短暂恢复意识时，当面确认陆川到场，并表示“别让那帮人继续糊弄”。",
    "存在一份由程振山于当日上午10点17分签署的临时授权文件。",
    "该授权文件由程振山私人医生与行政秘书见证，原件由法务与秘书处封存。",
    "授权内容为：在程振山因健康原因暂时无法正常履职期间，指定陆川临时代理董事长职责，参与公司重大决策事项之召集、确认与临时处置。",
    "授权持续条件为：在程振山恢复履职，或董事会形成新的有效决议前，该授权持续有效。",
    "陆川的临时身份已被苏蔓宣读并正式记入公司会议记录。"
  ],
  "character_state_changes": [
    {
      "character": "陆川",
      "change": "从普通跑单骑手突然被卷入迅城达权力核心，身份被文件指定为临时代理董事长，但本人强烈抗拒且完全不知内情。"
    },
    {
      "character": "程振山",
      "change": "突发昏迷，暂时无法正常履职，但在昏迷前和短暂清醒时都明确指向陆川与相关文件。"
    },
    {
      "character": "苏蔓",
      "change": "在公司危机中站到程序执行核心位置，选择按程振山指示推进文件公开，未向韩啸让步。"
    },
    {
      "character": "韩啸",
      "change": "在程振山失能后迅速试图控场、压住文件影响，并对陆川表现出明显排斥与警惕。"
    },
    {
      "character": "魏岚",
      "change": "在董事会中表现冷静克制，优先审查授权文件的程序合法性与边界。"
    }
  ],
  "relationship_changes": [
    "陆川与程振山之间被明确建立了异常且关键的指定关系：程振山在危急时刻点名陆川，并授予其临时代理董事长身份。",
    "陆川与苏蔓形成暂时的程序同盟关系，苏蔓是当前最明确维护其文件身份的人。",
    "陆川与韩啸形成直接对立，韩啸希望将其排除出核心场域并弱化授权效力。",
    "苏蔓与韩啸在是否立即执行程振山授权文件上出现公开冲突。",
    "董事会多数成员对陆川的态度从陌生转为震惊、排斥和警惕。"
  ],
  "foreshadowing_updates": [
    {
      "id": "fs_luchuan_chosen_reason",
      "status": "new",
      "note": "核心悬念建立：程振山为什么偏偏选择陆川，且陆川本人似乎并不知情。"
    },
    {
      "id": "fs_authorization_power_struggle",
      "status": "new",
      "note": "临时授权文件已公开，后续必然围绕其合法性、边界与执行权展开董事会权力斗争。"
    },
    {
      "id": "fs_hanxiao_hidden_agenda",
      "status": "new",
      "note": "韩啸急于控场、限制文件外扩，显示其可能有既得利益或隐情。"
    },
    {
      "id": "fs_chengzhen_shan_words_muddling",
      "status": "new",
      "note": "程振山所说“别让那帮人继续糊弄”暗示公司内部早有问题，且董事会中可能有人不可信。"
    }
  ],
  "location_or_org_changes": [
    "迅城达总部进入突发事件状态，顶层会客区临时转为医疗与危机处理现场。",
    "迅城达内部已启动信息控制，涉及媒体口径统一与电梯权限限制。",
    "董事会被紧急召集并被迫面对一份会改变权力结构的授权文件。",
    "公司正式会议记录中新增陆川“临时代理董事长”身份，组织结构事实上出现临时性异常变动。"
  ],
  "must_remember_next": [
    "陆川已被正式记入迅城达会议记录，身份是程振山指定的临时代理董事长。",
    "授权文件签署时间为当日上午10点17分，见证人为私人医生和行政秘书，原件由法务与秘书处封存。",
    "授权生效条件是程振山暂时无法履职；终止条件是程振山恢复履职或董事会形成新的有效决议。",
    "陆川本人对授权完全不知情且抗拒，不愿背锅，也不理解自己为何被选中。",
    "苏蔓当前坚持按程序执行文件，是陆川在公司内部最直接的制度支持者。",
    "韩啸明确试图压制此事并排斥陆川，后续大概率会成为主要阻力之一。",
    "程振山短暂清醒时亲口确认陆川到场，并说过“别让那帮人继续糊弄”，这是判断公司内斗与阴谋的重要线索。"
  ]
}