{
  "chapter_index": 4,
  "summary": "陆川在会议上质疑“总体稳定”报表，连续追问送达结果、赔付与商户催单，认定总部用话术掩盖一线异常。韩啸试图以程序和合规拖延现场核验，苏蔓则用临时董事长授权发出巡检通知并全程留痕。陆川与苏蔓赶到核心分拨点，发现仓内积压、错分、月台等待、骑手空跑严重。通过调度单和轨迹单，陆川确认问题核心不是单量或人手，而是系统为追求负载均衡和好看报表，强行近单拆远、跨区派单，导致送达变慢、仓内拥堵和赔付投诉上升。他由此锁定：有人坚持让这套明知有害的调度规则继续运行。",
  "new_facts": [
    "总部会议口径认为履约波动已进入可控区间，强调负载平衡、接单均衡度和平均响应时间收敛。",
    "陆川判断运营问题的核心指标是实际送达结果，而非宏观报表波动。",
    "韩啸在陆川提出去核心分拨点现场核验时，持续以程序、舆情、合规和接待安排为由拖延。",
    "苏蔓可调用陆川的临时董事长授权，向核心分拨点发出即时巡检通知，并抄送运营、法务、行政和安保以形成程序留痕。",
    "陆川拒绝总部安排的商务车和接待流程，改开后勤旧面包车直接前往现场。",
    "核心分拨点现场存在货筐积压、错分件、重复分拨标签、线路车等待、骑手集中抱怨空跑与超时扣罚等问题。",
    "现场分拨主管说明系统推单混乱，波次攒不齐，分拨员只能按扫码枪指令执行。",
    "老周确认部分骑手原本有固定覆盖区，但近期系统频繁将近单拆远、跨区派发。",
    "陆川通过调度单和轨迹单发现，同一商圈订单被派给远端骑手，而近处骑手又被拉去别处补单。",
    "调度员承认近期策略更看重区域负载均衡和响应率，是为了把片区数字拉平、让报表更好看。",
    "现场IT支持说明回退系统版本或策略的权限不在现场，现场只能按当前版本继续运行。",
    "陆川确认现状不是偶发错派，而是一套持续生效的调度规则在系统层面制造问题。"
  ],
  "character_state_changes": [
    {
      "character": "陆川",
      "change": "从对报表不信任升级为亲自下场核验，并明确判断问题根源在系统调度规则而非单纯人手或单量。"
    },
    {
      "character": "韩啸",
      "change": "在陆川面前首次明显暴露出试图控制现场访问和延缓调查的立场，表面克制但警惕加深。"
    },
    {
      "character": "苏蔓",
      "change": "从旁观记录者转为程序与证据执行者，主动协助陆川留痕、发通知、拍摄原始记录。"
    },
    {
      "character": "老周",
      "change": "起初对陆川冷嘲试探，看到其能看懂错派与路径问题后，态度转为认可和配合。"
    },
    {
      "character": "分拨主管",
      "change": "从试图用现场忙乱和单量暴涨解释问题，转为暗示上面不允许回退、数据导向导致现场受害。"
    }
  ],
  "relationship_changes": [
    "陆川与韩啸的矛盾从会议分歧升级为现场核验权限与真实问题认定的正面冲突。",
    "陆川与苏蔓形成临时协作关系，苏蔓开始在程序和证据层面支持陆川。",
    "陆川在骑手、老周和分拨现场人员中的可信度上升，被视为真正理解一线问题的人。",
    "苏蔓对陆川的判断力从观察转向初步认可，但仍保持监督姿态。"
  ],
  "foreshadowing_updates": [
    {
      "id": "system_dispatch_rule_manipulation",
      "status": "new",
      "note": "已明确存在一套为美化报表而牺牲实际送达的系统调度规则，后续需要查出是谁坚持让其继续运行。"
    },
    {
      "id": "han_xiao_obstruction",
      "status": "new",
      "note": "韩啸多次以流程、合规、舆情和接待为由阻止或拖延现场核验，后续可能涉及掩盖责任或利益关联。"
    },
    {
      "id": "suman_stands_with_evidence",
      "status": "new",
      "note": "苏蔓开始系统性保存通知、录像、单据、版本号和日志，后续这些证据可能成为追责关键。"
    }
  ],
  "location_or_org_changes": [
    "公司内部对运营现状存在明显割裂：总部报表口径称稳定，而核心分拨点处于高压混乱状态。",
    "核心分拨点已出现因错派和碎片化波次导致的仓内拥堵、月台等待和骑手空跑连锁反应。",
    "运营系统当前策略以负载均衡和响应率为优先，实际压低了真实履约效率。",
    "系统回退或修改权限集中在更高层，现场站点与分拨点无权纠偏。"
  ],
  "must_remember_next": [
    "陆川已经拿到调度单、派送轨迹、打印时间、工号、系统版本号等原始证据。",
    "下一步核心问题是查出谁决定并坚持让这套调度规则继续运行。",
    "韩啸明确反对陆川未经安排直查现场，后续双方冲突会继续升级。",
    "苏蔓已发出正式巡检通知并留痕，后续任何阻拦、删改或销毁记录都可能成为重要情节。",
    "问题本质已从现场混乱上升为系统层面的策略性失真与可能的人为责任。"
  ]
}