{
  "chapter_index": 18,
  "summary": "陆川到城西核心站点稳住被挖角的站长和骑手，提出异常赔付复核、保送达优先、站点临时调价回归一线三条措施，并借真实压力上报设局追查内鬼。苏蔓、何小满、老周等配合用分层诱饵和权限留痕锁定郑维提前获知并转发关键信息。夜高峰中陆川兑现调度改动，稳住城北局面，但也发现诱饵报表早于郑维来电被异常导出。凌晨法务截获郑维一方预提交的董事会材料，内容为罢免陆川并拆分出售核心站点，战场转向董事会层面。",
  "new_facts": [
    "城西核心站点存在长期问题：空跑补贴明显少挂，超时赔付曾被一刀切扣到骑手头上。",
    "竞争对手“闪奔到家”正在挖核心站长与商户，提供站长保底、补贴、提成和所谓站点自治合同。",
    "陆川当场承诺并推动三项临时规则：异常赔付复核不直接扣骑手、爆单时调度优先保送达、站点临时调价权限回到站长和值班调度联签。",
    "陆川要求站点按郑维平时关注的节奏如实上报爆单、缺骑手、赔付风险，以真实压力钓出内部泄密与操盘者。",
    "何小满发现近期站点异常信息并非全量泄露，而是有人提前拿到足够做决策的关键部分数据。",
    "苏蔓明确调查边界：不能非法取证、不能改系统原始数据、不能过度表演，目标是留痕形成董事会质询起点。",
    "团队设计A/B错位诱饵信息，并结合权限查看、系统日志、流程截图追踪谁读取和推动了信息流转。",
    "郑维给不归其直管的城北二站设置了额外订阅和手工汇总提醒，表明其持续盯防该核心站点。",
    "夜高峰时群内出现“董事会拟切核心站点止损”截图，进一步引发骑手动荡和竞品地推趁机抢人。",
    "郑维在电话中要求站点如实上报运力波动、管理失控、商户流失风险，表现出推动负面定性的意图。",
    "陆川现场兑现新规：城北核心站点切入保送达模式，白名单生效，部分卡死订单被优先分发。",
    "诱饵信息对应报表在郑维来电前二十分钟已被异常导出并转发，说明有人抢先点火制造风声。",
    "郑维一方在站点局面未定时，就已生成《区域运行风险提示及临时管理优化建议》初稿。",
    "郑维助理提前催办董事会紧急材料预排版，并称“领导已经定性了，只差附件补全”。",
    "法务截获的预提交报告最终建议为：立即罢免临时董事长陆川，并拆分出售核心站点资产止损。",
    "苏蔓利用权限将该材料卡在“待法务合规复核”节点，为后续反击争取时间并留痕。"
  ],
  "character_state_changes": [
    {
      "character": "陆川",
      "change": "从单纯稳站点转为同时追查内鬼与应对董事会罢免危机；成功用实际规则和调度改动重新赢回一线信任。"
    },
    {
      "character": "老周",
      "change": "由准备观望甚至可能被挖走，转为带头压住一晚、不签竞品协议，并配合陆川的留痕与诱饵计划。"
    },
    {
      "character": "苏蔓",
      "change": "明确成为陆川阵营中负责合规、流程卡点和董事会战线的关键执行者。"
    },
    {
      "character": "何小满",
      "change": "通过日志和权限排查成为技术取证核心，确认存在关键数据提前泄露与异常导出。"
    },
    {
      "character": "郑维",
      "change": "从幕后施压升级为实质性推动罢免陆川、拆分核心站点的主动进攻者，且留下更明确流程痕迹。"
    }
  ],
  "relationship_changes": [
    "陆川与老周及核心站长、骑手代表之间的信任显著恢复，从对立试探转为条件性同盟。",
    "基层站点、调度、技术、法务第一次形成实质协同，共同对抗郑维的操盘。",
    "陆川与苏蔓的合作进一步加深，分工明确为一线稳盘与楼上法务/董事会防线配合。",
    "陆川与郑维的矛盾公开升级，从站点控制权之争转向董事会层面的罢免与资产拆分之争。"
  ],
  "foreshadowing_updates": [
    {
      "id": "internal_leak_operator",
      "status": "advanced",
      "note": "通过错位诱饵、权限订阅和异常导出，基本锁定郑维一线在提前获取并利用站点关键信息，但尚未形成最终定案证据。"
    },
    {
      "id": "core_station_poaching",
      "status": "advanced",
      "note": "闪奔到家已实质接触核心站长和商户，今晚被老周暂时压住未签，但挖角威胁仍在。"
    },
    {
      "id": "boardroom_coup_against_luchuan",
      "status": "new",
      "note": "郑维已预提交罢免陆川并拆分出售核心站点的董事会材料，下一阶段主战场转到董事会。"
    },
    {
      "id": "station_rule_reform_effect",
      "status": "advanced",
      "note": "陆川承诺的赔付复核、保送达优先、临时调价权限已开始落地，成为争取一线人心的重要筹码。"
    }
  ],
  "location_or_org_changes": [
    "城西核心站点原本接近倒向竞品，现由老周带头决定今晚暂不签外部协议，进入观望但配合总部整改状态。",
    "城北二站被确认是郑维重点盯防的核心站点，并已被设置额外订阅和手工汇总提醒。",
    "城北核心站点夜高峰临时切入保送达模式并启用白名单，调度策略从报表优先转向履约优先。",
    "公司内部形成临时联动机制：站点、调度、技术、法务共同执行留痕和诱饵方案。",
    "法务办公室已将郑维一方的董事会材料卡在合规复核节点，暂时阻滞其上会节奏。"
  ],
  "must_remember_next": [
    "郑维一方已准备正式推动：罢免陆川、拆分出售核心站点资产。",
    "诱饵报表在郑维来电前已被异常导出转发，这是后续追查内鬼和质询郑维的重要时间证据。",
    "城北二站是郑维额外订阅和重点监控的站点，后续可能继续被拿来做文章。",
    "老周和核心站点目前只是被陆川用结果暂时稳住，若新规兑现失败仍可能流失。",
    "陆川承诺的三条规则已经开始执行，后续必须兑现补差、赔付复核和调度优先，否则会失去刚赢回的人心。",
    "苏蔓已卡住董事会材料的合规流程，她将是楼上战线的关键节点。",
    "基层、技术、法务首次站到同一边，这是陆川当前最重要的组织基础。"
  ]
}