{
  "chapter_index": 12,
  "summary": "陆川从老周站点账本中确认，履约率虽回升，但大量异常单的成本被一刀切压到骑手和站点，导致末端持续亏损。他与苏蔓将问题整理为“异常单责任拆分试行机制”和“站点申诉直通机制”，在会议上顶住韩啸与财务的反对，争取到老周站点两周试点。会后老周公开支持陆川，但竞争平台“闪奔到家”立即到站点门口挖人，说明试点已触动运力争夺与公司命脉。",
  "new_facts": [
    "老周长期手工记录异常单账本，详细留存商户卡餐、系统错派、客服回传滞后及对应扣款证据。",
    "迅城达当前存在同一异常单被超时扣、改派损耗、用户取消分摊等多重扣罚叠加的问题。",
    "老周站上周异常单137单，其中纯骑手责任不到三成，多数责任来自商户、系统、客服或地址问题。",
    "陆川不再只做现场补线救火，开始推动制度层面的规则调整。",
    "苏蔓提出并协助成文两项方案：异常单责任拆分试行机制、站点申诉直通机制。",
    "试点方案限定四类异常：错派、商户超时出餐、客服处置滞后、系统异常。",
    "试点范围被限定在老周站点，周期两周，数据单列，周中汇报，不追溯历史，不扩展全网，不冲击主时效考核。",
    "韩啸对试点保留意见，但未能阻止，只要求边界锁死、不能扩散。",
    "一名董事认可先做单点试验，做成再复制，做不成则证明此路不通。",
    "老周公开在站点群为陆川背书，并承诺亲自盯申诉直通。",
    "竞争平台“闪奔到家”在试点消息放出不到半小时即到老周站点门口挖人，说明其高度关注迅城达运力波动。",
    "闪奔到家以更高单价、晚高峰保底、周结为条件吸引老周站点骑手跳槽。"
  ],
  "character_state_changes": [
    {
      "character": "陆川",
      "change": "从主要依靠补人补线的救火思路，转向推动制度修正；成功撬开总部规则试点口子，并意识到自己触动的是运力命脉。"
    },
    {
      "character": "苏蔓",
      "change": "从辅助分析转为关键制度设计者，用总部能接受的话术将陆川的一线诉求转化为正式试点方案。"
    },
    {
      "character": "老周",
      "change": "由单纯愤怒抱怨总部不公，转为公开接下试点、站到陆川一边，同时以结果为条件表态支持。"
    },
    {
      "character": "韩啸",
      "change": "继续坚持稳大盘和执行力叙事，但在证据与试点框架面前被迫让步，只能保留意见。"
    }
  ],
  "relationship_changes": [
    "陆川与老周的互信明显增强，老周从质疑转为公开为陆川背书。",
    "陆川与苏蔓形成更稳固的配合关系：陆川提供一线压力与推进力，苏蔓负责制度化表达与落地框架。",
    "陆川与韩啸的对立升级，从执行层面的分歧上升为规则与责任归属的冲突。",
    "总部部分董事对陆川的态度出现松动，愿意给其单点试验机会。",
    "迅城达与闪奔到家的竞争由暗中抢人升级为围绕老周站点的直接运力争夺。"
  ],
  "foreshadowing_updates": [
    {
      "id": "pilot_laozhou_station_rule_split",
      "status": "new",
      "note": "老周站点将进行为期两周的异常单责任拆分和申诉直通试点，结果将决定是否复制或被否定。"
    },
    {
      "id": "hanxiao_resistance_to_reform",
      "status": "new",
      "note": "韩啸虽未阻止试点，但明确要求边界锁死，后续可能继续限制、挑错或借试点失败反扑。"
    },
    {
      "id": "rider_retention_crisis",
      "status": "new",
      "note": "骑手对试点普遍不敢轻信，真正能否留人取决于月底实际少扣多少钱。"
    },
    {
      "id": "shanben_poaching_attack",
      "status": "new",
      "note": "闪奔到家迅速到站点门口挖人，说明外部竞争会趁试点与内部波动加剧争夺运力。"
    },
    {
      "id": "lucuan_touching_core_interests",
      "status": "new",
      "note": "陆川意识到自己动到的不只是罚单流程，而是公司与行业围绕末端运力的核心利益结构。"
    }
  ],
  "location_or_org_changes": [
    "老周站点被总部正式确定为异常单责任拆分试点站点。",
    "迅城达总部暂时同意建立异常单责任拆分试行机制和站点申诉直通机制，但仅限单点、短周期、严边界。",
    "总部对异常单责任归属的既有口径首次被正式撬开，‘执行力不足’的单一解释出现裂缝。",
    "老周站点因试点消息成为外部平台重点挖角目标，站点稳定性面临新压力。"
  ],
  "must_remember_next": [
    "试点只在老周站点进行，两周周期，四类异常可拆分责任：错派、商户超时出餐、客服处置滞后、系统异常。",
    "试点配套有站点申诉直通机制，需附调度轨迹、商户时间戳和客服记录，由运营、客服、法务联合复核。",
    "试点边界明确：不追溯历史、不扩展全网、不冲击主时效考核，韩啸仍在盯边界。",
    "老周已公开接下试点并为陆川背书，但支持附带条件：做成则帮忙说服其他站点，做不成不替总部洗地。",
    "骑手对改革信任不足，核心检验标准是实际扣款是否减少、收入是否回升。",
    "闪奔到家已开始当面挖老周站点骑手，后续很可能继续利用试点不确定性制造人心波动。"
  ]
}