{
  "chapter_index": 10,
  "summary": "陆川因“骑手董事长作秀翻车”视频登上热搜，引发商户停单、骑手担心赔付与提现、站长恐慌。韩啸主张统一封口公关，陆川坚持先稳业务，亲赴站点重排午高峰策略：保头部商户、保高投诉线路、保熟路骑手，并承诺异常赔付总部先兜、商户直连站点。午高峰后重点门店准时率明显回升，赵姐恢复部分单量。苏蔓与何小满进一步发现视频传播先入商户群，且后台参数存在越权修改，表明此次舆情与系统异常、内部泄密可能是联动攻击。",
  "new_facts": [
    "一条题为“某物流公司‘骑手董事长’现场翻车，全靠演？”的短视频在早高峰前发出并登上热搜，集中剪辑陆川现场工作的狼狈片段。",
    "热搜直接导致线下业务受损：赵姐先暂停中午30单，骑手担心提现延迟和赔付，多个站长要求总部给准话。",
    "韩啸提出标准公关方案：统一对外口径、站点禁止私自回应、暂停现场拍摄、封闭信息出口。",
    "陆川明确提出舆情本质是业务信心问题，核心应对是稳住送达、赔付和商户沟通，而非先封口。",
    "苏蔓判断偷拍视频角度不像路人拍摄，怀疑行程与素材来自内部信息流出。",
    "陆川在站点制定午高峰止血策略：优先保头部商户、保高投诉线路、保老骑手熟路段，非核心单延后。",
    "陆川当场承诺午高峰异常赔付由总部先兜，系统乱派、拆单失误、重复绕路不算骑手责任，商户客服改为站点直连。",
    "赵姐在11:20同意先恢复三成单量，条件是1:30前看到送达结果；午高峰后又回了四成单量。",
    "商户群里在热搜前后已有人用近似统一话术散播“内部消息，迅城达高层已乱”的内容，说明传播有预置投放。",
    "午高峰止血见效：20家重点门店准时率从61%提升到83%，赵姐线路准时率从51%提升到68%，超时单减少，在线骑手数中午未再下滑。",
    "魏岚在会议上认可陆川拿回的是结果而非情绪。",
    "苏蔓提出按内控事件调查：调取监控访问记录、拍摄授权、素材外发路径、商户群扩散节点和调度权限日志。",
    "何小满发现后台日志异常：晚高峰前20分钟及商圈高密度时段，派单优先级和调度阈值被越权修改，非正常审批链路执行。",
    "后台异常时间与站点混乱、商户恐慌、热搜抬头高度同步，显示系统异常、舆情扩散和偷拍视频可能是内外联动的针对性操作。",
    "陆川最终确认问题已不只是送单，而是有人借系统和舆情一起对他及公司下手。"
  ],
  "character_state_changes": [
    {
      "character": "陆川",
      "change": "从被热搜激怒转为冷静主导现场止血，并意识到事件背后可能是针对他的系统性布局。"
    },
    {
      "character": "苏蔓",
      "change": "从协助会议投屏转为主动主导内控调查，明确将事件升级为可能的内部泄密与权限问题。"
    },
    {
      "character": "韩啸",
      "change": "坚持公关封口路线，与陆川在处理思路上公开对立。"
    },
    {
      "character": "老周",
      "change": "起初对总部和陆川有怨气，后在陆川给出明确兜底方案后重新配合调度。"
    },
    {
      "character": "赵姐",
      "change": "从强烈怀疑迅城达要垮、准备切单，转为基于结果恢复部分单量，对陆川评价有所缓和。"
    },
    {
      "character": "骑手群体",
      "change": "从担心白跑和背赔付、不愿接单，转为因异常赔付冻结和责任兜底而恢复接单意愿。"
    },
    {
      "character": "魏岚",
      "change": "在董事层面首次明确为陆川的现场结果背书。"
    },
    {
      "character": "何小满",
      "change": "提供关键后台日志证据，成为揭开越权改参数问题的重要技术证人。"
    }
  ],
  "relationship_changes": [
    "陆川与韩啸的分歧公开化：一方主张业务止血，一方主张公关封口，冲突升级。",
    "陆川与苏蔓形成更紧密的行动同盟：陆川负责稳一线，苏蔓负责记录口径与追查内控问题。",
    "陆川与老周、站点骑手的信任有所修复，核心原因是他承诺总部兜底且亲自下场。",
    "陆川与赵姐的关系从强烈不信任转为谨慎观望下的有限恢复合作。",
    "部分董事对陆川的看法改观，从把他当挡火墙转向承认其具备现场和管理能力。"
  ],
  "foreshadowing_updates": [
    {
      "id": "internal_leak_and_filming_source",
      "status": "new",
      "note": "偷拍视频角度来自非开放区域，陆川临时行程被精准捕捉，指向内部泄密或有人主动喂料。"
    },
    {
      "id": "preplanned_public_opinion_attack",
      "status": "new",
      "note": "视频未先自然发酵，而是先进入商户群和本地从业群，且话术统一，说明舆情传播可能经过预先设计。"
    },
    {
      "id": "backend_parameter_tampering",
      "status": "new",
      "note": "何小满发现派单优先级和调度阈值被越权修改，系统异常并非单纯故障。"
    },
    {
      "id": "coordinated_inside_outside_attack",
      "status": "advanced",
      "note": "系统篡改、商户群扩散与热搜时间高度同步，陆川判断有人里外联动设局。"
    }
  ],
  "location_or_org_changes": [
    "迅城达因热搜陷入舆情与业务双重危机，商户、骑手、站长信心同时下滑。",
    "站点临时建立现场指挥区，以人工方式重排重点门店、线路和骑手分配，对抗系统乱派。",
    "总部临时执行异常赔付先冻结、不自动扣骑手的处理口径。",
    "商户沟通机制从总部转接改为站点直连，提高一线响应速度。",
    "公司内部已启动对监控访问、拍摄授权、素材流转、商户群扩散节点和调度权限日志的调查。"
  ],
  "must_remember_next": [
    "陆川已把事件认定为不只是舆情，而是涉及内部泄密与后台越权改参数的联动攻击。",
    "何小满掌握关键日志：派单优先级和调度阈值在关键时段被越权修改，后续很可能继续追查账号归属和操作者。",
    "苏蔓已推动法务和内控按事件立案方向调查，后续会沿权限、审批、素材流转三条线深挖。",
    "韩啸仍坚持统一封口公关路线，与陆川的路线冲突尚未解决。",
    "赵姐已恢复部分单量，但仅是谨慎试单，若后续履约再崩仍可能再次抽单。",
    "午高峰止血成果为陆川争取到部分董事态度松动，但远未真正扭转公司整体危机。",
    "总部已承诺异常赔付先兜底且不自动扣骑手，这一口径后续必须兑现，否则会反噬信任。"
  ]
}