{
  "chapter_index": 17,
  "summary": "陆川、何小满、苏蔓以合规排查名义追查站点异常，发现有人通过第三方服务商账号精准调用站点、商户名单并改动调度参数，异常时间与商户被挖、舆情发酵、站长骑手被截高度吻合。何小满进一步查到该访问IP段与长期服务闪奔到家的公关公司有关。三人决定先不摊牌，转为布网盯新动作、补齐授权链与动作链。但老周来电警告：郑维已开始连夜接触核心站长，准备带人带运力投向闪奔到家，双方进入抢时间阶段。",
  "new_facts": [
    "陆川判断东河站、南苑、城西等多次运营事故并非自然失误，而是有人精准打击迅城达快的履约命门。",
    "三人确定分工：陆川负责筛选有业务价值的异常节点，何小满查权限与日志，苏蔓负责以合规流程包装调查并控制风险。",
    "调查采用“内部风险排查/供应商权限合规复核”名义推进，以保留审批和留痕，避免被反咬为越权调查。",
    "何小满在日志中发现，一个第三方服务商账号在异常时间访问了不该接触的站点、商户名单及调度参数。",
    "该第三方账号的操作方式具有针对性：不碰总盘与公共配置，只针对几个关键站点、商户名单和参数下手。",
    "名单调用与业务后果高度对应：调用后48小时内，多家相关商户被外部接触。",
    "参数小幅改动后，相关站点派单更容易落到边缘骑手，导致绕路增加、超时上升、骑手情绪恶化。",
    "可疑操作未使用郑维本人内部工号，而是借第三方服务商账号中转，规避了对内部高权限号的重点监控。",
    "该服务商近期还有一笔临时权限申请，申请时间就在当晚，说明可疑通道可能仍在使用。",
    "何小满进一步发现可疑IP段与一家公关公司的历史投放系统有交叉，而该公司长期为闪奔到家做舆情投放和市场公关。",
    "现阶段三人只能证明内部越权访问、名单外泄风险和外部竞争动作同步，尚未补齐授权链和直接指使链。",
    "陆川提出先不打草惊蛇，而是在通道上布网，盯住下一次名单调用、参数改动和业务异常，抓现行动作链。",
    "老周来电告知，郑维当晚正在分头接触城西、北环、老工业区等核心站长，条件是带人带运力跳去闪奔到家并提供保底。",
    "郑维计划让部分核心站长次日一起放话，不是单纯辞职，而是连人带运力一起带走，直接抽空站点盘子。",
    "局势从单纯取证升级为与郑维抢时间：若证据未及时上桌，站点可能先被掏空。"
  ],
  "character_state_changes": [
    {
      "character": "陆川",
      "change": "从凭业务直觉怀疑内鬼，推进到掌握初步技术与业务对照证据；策略上由想直接追查转为接受合规布网，但在得知郑维连夜挖站长后重新进入紧急应对状态。"
    },
    {
      "character": "何小满",
      "change": "从技术配合者转为关键证据提供者，成功从日志、权限、IP关联中摸到第三方账号与闪奔系公关公司的线索，并意识到对方可能已察觉风向。"
    },
    {
      "character": "苏蔓",
      "change": "明确主导调查的法律与合规框架，压制陆川的冲动，提出以供应商权限合规复核名义推进，确保后续证据可上董事会和审计桌。"
    },
    {
      "character": "老周",
      "change": "从站点线人/基层支撑者升级为关键预警来源，直接提供郑维正在挖核心站长与运力的实时情报。"
    },
    {
      "character": "郑维",
      "change": "从幕后疑似操盘者进一步显出主动性与警觉性，不仅可能借第三方账号动系统，还开始清理供应商老权限联系人并连夜抢挖站长。"
    }
  ],
  "relationship_changes": [
    "陆川、何小满、苏蔓形成更稳固的临时调查同盟，分工明确且互相制衡。",
    "陆川对何小满的信任提升，开始高度依赖她提供的日志与技术判断。",
    "陆川对苏蔓的态度从顶嘴和不服，转为接受其合规框架和行动约束。",
    "三人与郑维的对立升级，从隐性怀疑转向双方抢时间的正面博弈。",
    "老周与陆川之间的协作更紧密，老周开始承担稳住站点和传递一线情报的作用。"
  ],
  "foreshadowing_updates": [
    {
      "id": "third_party_account_channel",
      "status": "new",
      "note": "发现第三方服务商账号可作为内部数据和参数被操控的通道，且当晚还有新的临时权限申请，后续可能继续被使用。"
    },
    {
      "id": "flashrun_pr_link",
      "status": "new",
      "note": "可疑IP段与长期服务闪奔到家的公关公司有关，暗示系统越权、舆情投放和挖商户可能是一体化动作。"
    },
    {
      "id": "need_complete_chain_of_authorization",
      "status": "new",
      "note": "目前仅能证明高度关联，缺授权链和指使链，后续必须抓到能钉死“谁让这只手动”的关键证据。"
    },
    {
      "id": "zheng_wei_countermove",
      "status": "new",
      "note": "郑维可能已闻到风声，开始清理权限联系人并连夜接触核心站长，后续会加速反制或毁损证据。"
    },
    {
      "id": "core_station_poaching_imminent",
      "status": "new",
      "note": "城西、北环、老工业区等核心站长可能次日集体表态带队转投闪奔到家，站点运力面临被抽空的即时风险。"
    }
  ],
  "location_or_org_changes": [
    "迅城达快内部针对异常事件的调查正式进入合规化流程，名义为内部风险排查/供应商权限合规复核。",
    "迅城达快系统层面确认存在第三方服务商权限边界失控的风险，且该漏洞可能仍在被利用。",
    "青禾路、北桥、西城南仓等站点被确认是被精准打击的重点区域，异常与日志调用相互印证。",
    "城西、北环、老工业区等核心站点进入被挖角高风险状态，运力稳定性骤降。",
    "供应商对接群开始清理老权限联系人名单，说明组织内部权限环境正在变化，可能与郑维应对调查有关。"
  ],
  "must_remember_next": [
    "关键证据线索是第三方服务商账号、其临时权限申请、相关访问日志、名单调用记录、参数改动记录和对应业务后果对照表。",
    "可疑IP段关联一家长期为闪奔到家做舆情投放和市场公关的公司，这是将系统异常与外部竞争动作串联起来的重要线索。",
    "当前证据还不能直接坐实郑维，只能证明高度关联；后续必须补齐授权链、动作链和指使链。",
    "三人下一步策略不是立即摊牌，而是布网盯新动作：陆川盯业务异常，何小满盯技术触发，苏蔓盯合规流程。",
    "郑维已经开始抢时间，正在接触核心站长，可能次日就发起连人带运力的集体跳槽，这是下一章最紧迫冲突。",
    "老周负责尽量稳住站点人员，尤其防止当晚就出现人员散盘。"
  ]
}