{
  "chapter_index": 5,
  "summary": "陆川在管理层会议上抓住热点片区跨区派单问题，指出系统为保接单率牺牲真实送达，导致商户等待、骑手空跑和赔付堆积。苏蔓协助将争论落到数据，何小满确认技术上可做局部回切。陆川首次以临时董事长名义签发两日试点指令，在城南商圈、滨河路、旧城医院板块按近距离熟路线优先派单。会后何小满透露模型曾被人为改成“先把单发出去”的报表导向策略，并愿提供变更记录。与此同时，核心站点突发骑手集体停单，老周求援，韩啸则要求留痕以便复盘责任。陆川赶往站点救火。",
  "new_facts": [
    "热点片区长期存在跨区派单，导致表面秒接但实际晚送，本区运力被抽空，超时赔付集中在被跨区抽血的站点。",
    "当前调度模型核心倾向于优先接单响应、覆盖率和分发速度，而非真实履约效率。",
    "原始模型曾更贴近真实履约，会考虑骑手位置、商户出餐波动、楼宇密度、回程顺带等因素，后来被改动。",
    "技术上可以通过白名单片区、时间窗限制、人工经验规则做局部回切，无需全系统回滚。",
    "陆川正式以临时董事长名义签发短周期经营纠偏指令：城南商圈、滨河路、旧城医院板块从当日晚高峰起试跑两天，站点与调度联合执行，优先近距离、熟路线、熟商户，减少跨区与空跑。",
    "该试点要求次日中午十二点前提交履约率、赔付、商户反馈的对比复盘，并明确陆川承担决策责任。",
    "何小满保存了版本策略变更记录，愿意整理关键参数改动给陆川和苏蔓。",
    "核心站点已爆发骑手集体停单，原因是多日跨区乱派、空跑和超时赔付压到骑手头上，问题已从调度失衡升级为一线信任崩塌。",
    "韩啸在停单发生后强调记录其发生于调度策略调整窗口期，要求完整留痕以便后续归因责任。"
  ],
  "character_state_changes": [
    {
      "character": "陆川",
      "change": "从凭一线经验质疑系统，转为首次正式动用临时董事长权力下达试点经营指令，并确认问题可能涉及人为报表导向。"
    },
    {
      "character": "苏蔓",
      "change": "持续站在陆川一侧，帮助其将情绪转化为会议语言、合规指令和留痕机制，并接手盯防回切执行与系统日志。"
    },
    {
      "character": "韩啸",
      "change": "公开承认局部异常但坚持保接单率与资本口径，转而接受执行试点，同时开始为可能的失败预设责任归因框架。"
    },
    {
      "character": "何小满",
      "change": "从会议角落沉默者转为关键内部信息提供者，确认技术可行性并透露模型被改动，愿意留痕但仍谨慎自保。"
    },
    {
      "character": "老周",
      "change": "从站点问题反馈者升级为停单现场求援者，明确指出骑手停单源于长期被系统和赔付机制压榨。"
    }
  ],
  "relationship_changes": [
    "陆川与苏蔓的协作进一步稳固，形成‘决策+合规落地’的配合关系。",
    "陆川与韩啸的冲突升级，从业务分歧上升为路线与责任之争。",
    "陆川与何小满建立初步信任，何小满开始向他提供内部技术变更线索。",
    "何小满对苏蔓也建立了一定信任，因为她确认了授权留痕可防止技术被单独甩锅。"
  ],
  "foreshadowing_updates": [
    {
      "id": "foreshadowing_model_manipulation",
      "status": "new",
      "note": "何小满透露调度模型曾被改成报表导向，且有版本变更记录，后续可追查是谁拍板及背后目的。"
    },
    {
      "id": "foreshadowing_local_rollback_trial",
      "status": "new",
      "note": "三片区两日局部回切试点已启动，效果将直接影响陆川权威、公司责任划分和后续调度改革。"
    },
    {
      "id": "foreshadowing_rider_strike",
      "status": "new",
      "note": "核心站点骑手集体停单爆发，矛盾已从系统问题升级为一线人心危机，下一章需处理现场失控风险。"
    },
    {
      "id": "foreshadowing_hanxiao_blame_frame",
      "status": "new",
      "note": "韩啸强调调整窗口期留痕和复盘责任，后续可能将波动归咎于陆川的试点决策。"
    }
  ],
  "location_or_org_changes": [
    "公司管理层正式通过并留痕一份临时经营指令，允许在城南商圈、滨河路、旧城医院板块进行两日局部回切试跑。",
    "站点与调度被设定为联合责任主体，要求对试点进行对比复盘。",
    "核心站点发生骑手集体停单，现场接近失控，商户侧也面临连带冲击。",
    "公司内部关于调度问题的性质发生变化：从‘局部执行偏差’被揭开为可能存在系统性策略失真和人为导向。"
  ],
  "must_remember_next": [
    "陆川已经签字下令三片区局部回切试点，这是他首次正式使用临时董事长权力。",
    "试点范围、时长、责任和复盘要求都已留痕，不能被改写成技术私自操作。",
    "何小满手里有模型版本策略变更记录和关键参数改动线索，是后续调查重要证据来源。",
    "韩啸正在构建‘若出波动则归因陆川调整’的责任框架。",
    "核心站点骑手集体停单并非由刚下达的回切立即引发，而是长期跨区乱派、空跑和赔付压榨积累爆发。",
    "陆川已赶往站点，苏蔓留下盯回切执行和系统日志，下一章重点应是现场稳人心与防止内部甩锅。"
  ]
}