{
  "chapter_index": 7,
  "summary": "晚高峰站点爆单，待派单一度破百且派单路线严重失序，骑手因超时、罚款和差评情绪濒临停摆。陆川现场查看后台与实际路线，确认核心问题不是单量本身，而是系统按在线和接单率粗暴派发，完全不顾顺路逻辑与片区边界。他亲自下场跑单验证判断，并在站点用白板重划片区、手动拦截部分自动派单、优先清理会引发连锁爆炸的红单，同时承诺按新跑法产生的超时争议先记站点调整，不压到个人头上。老周随之配合压场，站点秩序初步恢复，待派单开始下降。骑手态度转为暂时观望，愿意再给一天看规则是否真改。章末赵姐带着总部客诉与赔付单上门追责，新的冲突被引爆。",
  "new_facts": [
    "第7章晚高峰时，站点待派订单数迅速攀升，现场一度失控，骑手普遍因系统派单混乱而不愿继续接单。",
    "陆川确认当前核心问题是系统自动派单只看在线状态、活跃度和接单率，忽视顺路逻辑、片区边界和实际履约路径。",
    "系统会把近单拆散、顺路单不并、跨片区单强塞给同一骑手，导致骑手高频绕路、取餐超时和连锁差评。",
    "陆川重新穿上骑手角色亲自跑单，用实际路线记录证明人工顺路跑法明显优于系统推荐路径。",
    "陆川在站点用白板临时划分片区，要求骑手固定熟悉区域，不再满城乱窜。",
    "陆川提出红单救火机制：普通单尽量不跨区，但会优先处理可能引发商户连锁爆炸的压单。",
    "陆川公开承诺，按临时片区方案跑产生的超时争议先记站点调整，不先算到个人头上，并由自己和老周盯。",
    "在陆川和老周组织下，站点开始从依赖系统自动派单转为人工按片区、红单优先、顺路并单的临时调度模式。",
    "临时调度生效后，电子屏待派订单从高位开始下降，站点秩序明显恢复，但问题并未彻底解决。",
    "多名骑手明确表态只愿再观望一天：如果第二天系统仍乱派且超时继续由个人承担，他们仍可能停摆。",
    "章末赵姐拿着大量超时与客诉打印单赶到站点，代表总部或上级业务端开始追责赔付问题。"
  ],
  "character_state_changes": [
    {
      "character": "陆川",
      "change": "从被骑手嘲讽的“董事长”转为亲自下场跑单、用现场数据和实操接管临时调度的人，获得初步现场认可，并主动承担站点调整带来的责任压力。"
    },
    {
      "character": "老周",
      "change": "起初强烈讽刺和不信任陆川，后因陆川亲自跑单并提出有效片区调度方案，转为配合压场、协助执行，但仍保持谨慎与未完全站队。"
    },
    {
      "character": "站点骑手群体",
      "change": "从愤怒、抵触、接近停摆，转为在片区化临时方案下恢复一定执行力，但对平台规则仍不信任，只愿短暂观望。"
    },
    {
      "character": "调度员",
      "change": "从被系统自动派单牵着走、基本失去控制，转为开始配合人工拦单、盯红单和补边界缺口。"
    },
    {
      "character": "赵姐",
      "change": "以强硬追责姿态登场，带着超时和赔付压力直接质问站点负责人，成为下一轮冲突核心。"
    }
  ],
  "relationship_changes": [
    "陆川与老周的关系由明显对立和讥讽，转为建立了基于现场能力的初步信任与合作。",
    "陆川与骑手群体的关系由“总部来的人”转为“愿意亲自跑且懂现场的人”，但这种认可附带明确的次日考验条件。",
    "老周与站点骑手的组织关系被重新强化，他开始配合陆川用白板片区规则重新压住场面。",
    "站点与总部/上级管理端的矛盾进一步显性化，现场救火逻辑与总部报表、赔付追责逻辑开始正面冲突。"
  ],
  "foreshadowing_updates": [
    {
      "id": "system_dispatch_rule_conflict",
      "status": "new",
      "note": "系统派单算法与真实履约逻辑严重冲突已被陆川当场证实，后续很可能引发规则层面的整改或与总部的博弈。"
    },
    {
      "id": "rider_walkout_risk",
      "status": "new",
      "note": "骑手只答应再观望一天，若次日仍乱派且责任继续压个人，站点存在再次停摆或集体抵触风险。"
    },
    {
      "id": "lu_chuan_takes_responsibility",
      "status": "new",
      "note": "陆川已公开表示超时争议先记站点调整、让总部冲自己来，后续他将直接承受管理层问责。"
    },
    {
      "id": "zhao_jie_accountability",
      "status": "new",
      "note": "赵姐带着超时、客诉和赔付单到站点追责，下一章大概率会围绕责任归属、赔付承担和规则冲突展开。"
    }
  ],
  "location_or_org_changes": [
    "本章站点从失控爆单状态，暂时转入人工片区化调度与红单优先的应急运行状态。",
    "站点内部形成了白板片区划分、边界补缺、红单救火的临时现场规则，部分替代系统自动派单。",
    "迅城达站点与总部之间的矛盾从内部抱怨升级为即将发生的直接追责对抗。"
  ],
  "must_remember_next": [
    "陆川已经在现场证明系统派单逻辑有问题，问题核心是算法忽视顺路与片区，不是单量本身不可承受。",
    "陆川提出并执行了临时方案：片区固定、人工拦单、顺路并单、红单优先救火。",
    "陆川当众承诺按临时方案产生的超时争议先记站点调整，不先压到骑手个人头上，这会成为后续追责关键。",
    "老周已经开始配合陆川执行调度，但他的信任仍是有限且基于结果的。",
    "骑手群体只答应再观望一天，第二天规则是否真正变化将决定他们是否继续配合。",
    "章末赵姐带着大量超时、客诉、退款赔付单到站点追责，并当场质问谁负责，这是下一章直接承接的冲突起点。"
  ]
}