{
  "chapter_index": 14,
  "summary": "陆川、苏蔓、何小满排查名单外泄，发现异常并非随机，而是围绕重点区域连续发生。后台显示商户名单、区域运力与赔付相关数据曾在异常时段被临时权限访问，且存在导出痕迹、补签单、邮件绕行、秘书处留痕缺失和回收记录不完整等问题。陆川用一线经验排除正常运维访问后，锁定一条与郑维负责片区重合的关键残缺记录。三人确认方向指向有人利用流程混乱提前获知并利用关键数据，但证据仍不足。与此同时，材料被迅速封存，高层开始放风指责陆川翻旧账致管理失控，董事会正式通知将评估并可能提前解除其临时董事长职务。",
  "new_facts": [
    "近三周的站点失控、商户流失、赔付猛增呈现前后衔接的打击节奏，疑似有人提前掌握关键区域信息后定点下手。",
    "商户维护名单和区域运力表在多次事件前出现短时访问记录，其中两次疑似导出，但日志只留下接口调用，未保留最终落地端信息。",
    "存在一次临时放开权限的记录，系统中仅有“补录”，申请人和批准人责任链不清。",
    "夜里2点17分名单查询、2点23分运力页连续访问、2点29分导出动作的异常链条被发现，符合低峰时段非正常业务访问特征。",
    "多个账号曾被临时加上查看重点商户池的权限，但回收记录不完整，呈现“开过、用过、回退缺失”的状态。",
    "陆川依据暴雨预警前夜等业务背景，排除了部分正常运维和备灾访问，缩小了异常范围。",
    "一条残缺后台记录对应“核心商户名单更新”，发生在更新前夜，访问源账号有删改痕迹，落点区域正好在郑维负责片区。",
    "将异常赔付、商户流失和站点波动叠图后，按真实运力重划区域可见问题集中于大站交接带和关键动脉区域，而非全城随机爆发。",
    "郑维对异常最集中的几个区域具有深度协同接触面，涉及商户维稳、区域赔付协调和重点站点应急，不仅能看见名单，也能接触节奏。",
    "档案和审批中发现临时权限补签单申请时间空白、审批写有“业务紧急，先行处理”“代为知悉”等模糊表述。",
    "一份邮件打印件显示正常应抄送信息安全、业务负责人、秘书处留痕的流程被“代为转达”替代，且缺少秘书处原始回执。",
    "系统权限可见生效时间和调用记录，但前置申请动作缺失，说明有人可能先操作后补流程。",
    "三人刚准备继续调阅补签材料时，秘书处通知相关材料“正在归档整理，暂不可调阅”，疑似有人开始遮挡证据。",
    "高层圈子开始放风，称陆川上任后四处翻旧账导致管理失控，舆论开始反向施压陆川。",
    "董事会发出临时会议正式通知，将评估陆川任期内管理失控风险，并讨论是否提前解除其临时董事长职务。",
    "何小满确认部分访问记录七天覆盖、接口缓存更快消失，证据保全时间窗口很短。"
  ],
  "character_state_changes": [
    {
      "character": "陆川",
      "change": "从凭直觉想直接质问郑维，转为接受苏蔓的证据链思路，明确现阶段只能先钉流程再钉人。"
    },
    {
      "character": "陆川",
      "change": "通过重划真实运力区域，进一步发挥其一线经验，确认异常集中于关键动脉区域。"
    },
    {
      "character": "陆川",
      "change": "意识到自己正被对方抢在证据成形前从董事长位置上清除，处境骤然恶化。"
    },
    {
      "character": "苏蔓",
      "change": "从单纯提醒风险，转为主导证据标准与汇报策略，提出以侧证上报而非直接下结论。"
    },
    {
      "character": "苏蔓",
      "change": "得知材料被封和高层放风后，确认对方已开始反制，态度更严肃。"
    },
    {
      "character": "何小满",
      "change": "在数据比对中找到关键异常链条，并意识到日志留存时间有限，转入争分夺秒的保全状态。"
    },
    {
      "character": "郑维",
      "change": "在走廊主动试探三人调查进度，并以“稳定”为名施压，表现出已察觉调查方向。"
    }
  ],
  "relationship_changes": [
    "陆川对苏蔓的专业判断进一步信服，愿意压住冲动按法律和证据逻辑行动。",
    "陆川、苏蔓、何小满形成更紧密的调查同盟，分工明确为现场判断、证据规范和技术保全。",
    "陆川与郑维之间由潜在怀疑升级为公开试探和暗中对抗，但双方尚未撕破脸。",
    "郑维与高层/秘书处可能存在更深的联动遮挡，三人对内部阻力的判断明显增强。"
  ],
  "foreshadowing_updates": [
    {
      "id": "foreshadowing_list_leak_source",
      "status": "advanced",
      "note": "名单外泄方向明显指向内部权限滥用与流程绕行，且与郑维负责片区高度重合，但仍缺直接铁证。"
    },
    {
      "id": "foreshadowing_internal_protection_network",
      "status": "new",
      "note": "补签、邮件绕行、秘书处留痕缺失和材料被封存，暗示高层便利与保护链可能比单一操作者更关键。"
    },
    {
      "id": "foreshadowing_lu_chuan_position_crisis",
      "status": "new",
      "note": "董事会临时会议将评估并可能提前解除陆川临时董事长职务，对方开始先手夺权。"
    },
    {
      "id": "foreshadowing_evidence_time_window",
      "status": "new",
      "note": "日志七天覆盖、接口缓存更快消失，后续必须尽快保全证据，否则关键痕迹会自然灭失。"
    }
  ],
  "location_or_org_changes": [
    "公司内部对异常的判断从“全城普遍问题”转为“关键交接带和动脉区域被精准打击”。",
    "总部原有区域划分被证明与真实运力不匹配，掩盖了异常集中区域。",
    "权限审批、秘书处留痕和邮件抄送流程暴露出长期混乱且可被利用的组织漏洞。",
    "秘书处开始限制补签材料调阅，组织内部已出现对调查的实质性阻拦。",
    "董事会进入陆川去留评估程序，公司的权力斗争正式升级。"
  ],
  "must_remember_next": [
    "关键证据是名单更新前夜的残缺访问记录，其落点区域在郑维负责片区，但因账号删改和字段缺失尚不能直接定人。",
    "现阶段三条核心侧证：郑维负责区域与异常高度重合；名单导出权限曾临时放开且审批链不完整；后台日志存在缺口与系统外传递痕迹不匹配。",
    "不能直接质问郑维，否则会暴露调查深度并给对方反制空间。",
    "必须尽快保全日志、接口缓存和补签材料，因为部分记录会在短时间内被覆盖或自然清除。",
    "秘书处已开始封存/拖延关键材料调阅，说明调查可能被更高层盯上。",
    "高层舆论已转向指责陆川管理失控，董事会即将讨论解除其临时董事长职务。",
    "后续策略不是上报结论，而是上报可验证的侧证和流程缺口，先钉流程再钉人。"
  ]
}