{
  "chapter_index": 8,
  "summary": "陆川随韩啸、苏蔓去处理赵姐片区商户危机。韩啸主张统一口径、先控舆情，陆川则指出问题已不是客诉，而是调度、客服、赔付三条链路同时断线。赵姐在门店后厨当面摊牌：今晚若无改善，明天午高峰再炸，就带整片门店切去竞对“闪奔到家”。陆川现场承认问题，提出临时止血方案：优先保六家白名单门店、设专人盯单回传、异常单直连、当日确认处理口径。赵姐只给一晚观察期，明天午高峰成为公开考验。",
  "new_facts": [
    "赵姐不是单店老板，而是掌握该片区核心9家门店、并影响周边十几家门店风向的区域负责人。",
    "赵姐片区近三天出现连续异常：同店多单超时、骑手电话打不通、系统显示已跟进但无备注、客服无人接听、异常反馈未回、赔付拖延。",
    "竞对“闪奔到家”已在接触赵姐，等待其决定是否切单。",
    "赵姐明确表示：今晚看履约，明天午高峰看生死；若再炸，将不是一家店退出，而是整片门店切换平台。",
    "赵姐最在意的不是单次超时，而是异常发生后无人响应、无人闭环、责任不清。",
    "陆川在现场提出临时方案：今晚先保6家白名单门店，优先覆盖写字楼店、医院旁门店、两个社区爆单店和两家夜宵店。",
    "陆川要求白名单门店异常单设专人盯单，回传出餐、接单、到店、取走、卡住五个节点。",
    "陆川要求赵姐片区异常单只走一个入口，直接进群处理，避免跨部门踢皮球。",
    "陆川要求白名单异常单当日确认处理口径：说明责任归属、处理方式、赔付路径和跟进人，但不承诺当日打款。",
    "陆川会后在车内继续布置执行，要求半小时内给出白名单最终名单，并准备联系老周推进落地。"
  ],
  "character_state_changes": [
    {
      "character": "陆川",
      "change": "从会议室里质疑流程失效，转为在商户现场公开承认平台问题，并亲自制定临时止血方案，承担了兑现风险。"
    },
    {
      "character": "韩啸",
      "change": "坚持控口径、避免承认系统性问题；在陆川现场直认问题后与其分歧加深，但最终未再强拦，转为提醒承诺失信风险。"
    },
    {
      "character": "苏蔓",
      "change": "在陆川与韩啸之间充当执行与边界控制者，支持先谈执行动作，并负责把方案整理成可执行版本。"
    },
    {
      "character": "赵姐",
      "change": "由强烈不信任和愤怒，转为暂时接受陆川提出的一晚观察期，但本质上只给出倒计时式机会。"
    }
  ],
  "relationship_changes": [
    "陆川与赵姐建立了直接对话渠道，赵姐不信任总部，但暂时愿意给陆川个人一晚机会。",
    "陆川与韩啸在处理危机的方法上出现公开冲突：前者主张承认问题并先止血，后者主张控口径防扩散。",
    "苏蔓与陆川形成更明确的协同关系，负责为其临时方案补充执行边界和落地文本。",
    "赵姐与迅城达总部关系进一步恶化，对总部话术已近乎完全失去耐心。"
  ],
  "foreshadowing_updates": [
    {
      "id": "zhaojie_cut_order_deadline",
      "status": "new",
      "note": "赵姐设下明确期限：今晚看群和回传，明天午高峰若再炸，将带整片门店切去闪奔到家。"
    },
    {
      "id": "temporary_whitelist_test",
      "status": "new",
      "note": "陆川推出白名单特保、专人盯单、异常直连和当日确认口径的临时止血方案，下一章需验证能否顶住。"
    },
    {
      "id": "org_chain_break_exposure",
      "status": "new",
      "note": "调度、客服、赔付三条链路被明确指出同时断线，后续很可能暴露更深层组织问题。"
    },
    {
      "id": "public_failure_exam_noon_peak",
      "status": "new",
      "note": "明天午高峰被明确为真正的公开考试，届时会检验止血方案和平台底层履约能力。"
    }
  ],
  "location_or_org_changes": [
    "迅城达总部内部已明确意识到赵姐片区风险不再是单点客诉，而是可能引发区域性商户流失。",
    "赵姐所在片区被临时纳入高优先级特保区域，准备实行白名单门店保障。",
    "迅城达在该片区将临时建立跨站点、调度、客服的单一异常处理入口和回传机制。",
    "公司内部管理分歧公开化：一派强调舆情与口径控制，一派强调现场承认问题并快速闭环。"
  ],
  "must_remember_next": [
    "赵姐只给陆川一晚时间，不是给总部信任；明天午高峰结果将决定是否整片切单。",
    "白名单优先保6家门店，不能误写成全片区全面恢复。",
    "核心执行要求包括：半小时内确定名单、每店配盯单人、五节点回传、异常单单一入口、当日确认处理口径。",
    "陆川已在商户现场明确承认平台存在链条断裂问题，若方案失效，后果会从普通客诉升级为当面承诺后的再次失信。",
    "闪奔到家已在对面等赵姐回复，是现实且紧迫的竞争威胁。",
    "老周被陆川电话联系，下一章可能参与具体调度或执行落地。"
  ]
}