{
  "chapter_index": 13,
  "summary": "闪奔到家开始针对迅城达老周站点分层挖人，核心不是签约金而是制造“迅城达快不行了”的预期，动摇骑手信心。陆川判断这是一场信心战，临时制定“两周稳人执行表”：核心骑手新单按周结、历史欠项列时间表、开罚款复核口、两周内优先修复老周站点周边调度，不承诺额外补贴。陆川在站点公开承认公司问题，给出兑现边界，老周当场为其背书，成功暂时稳住骨干骑手，两周内不再跟风跳槽。章末赵姐来电，称闪奔挖商户时掌握了迅城达内部配送复盘级别的细节，陆川意识到公司内部可能有人向外泄露关键信息。",
  "new_facts": [
    "闪奔到家对迅城达采取分层挖人策略：站长谈整建制转移和过渡补贴，骨干骑手谈签约金和保底单量，新手骑手主打轻罚款、扣分少、次周结算。",
    "闪奔到家的核心挖人话术不是直接攻击迅城达，而是强调风险、结算安全和规则确定性，制造迅城达将出事的预期。",
    "老周站点近两周高峰接单密度回升12%，超时率从11.8%降到8.9%，说明前期调线路有效，但承载能力仍脆弱。",
    "何小满掌握的数据表明，闪奔新开片区的单量部分依赖跨区拉单，履约成本高，短期数据好看但后续未必稳定。",
    "陆川决定不与闪奔拼签约金，而是用可兑现的制度承诺稳人。",
    "老周站点形成“两周稳人执行表”：核心骑手新发生单据本周起按周结；历史欠项列清单和时间表；系统误判与调度连环派单导致的超时先人工复核；两周内调度优先修老周站点周边片区。",
    "陆川公开承认迅城达存在烂账、系统问题和管理层脱离一线的问题，拒绝用空话粉饰。",
    "老周站点多数骨干骑手最终选择先观望两周，不立即跳去闪奔，最危险的一波跟风离职被暂时压住。",
    "赵姐透露闪奔到家已开始挖商户，并准确掌握她城西三家店在高峰时段、商场卡点、汤品洒漏赔付、雨天延误等内部复盘细节。",
    "陆川据此怀疑迅城达内部存在信息外泄，竞争对手可能拿到了内部运营资料。"
  ],
  "character_state_changes": [
    {
      "character": "陆川",
      "change": "明确认识到当前竞争本质是‘信心战’，策略从单纯修系统转向用结算、罚款、调度等可兑现规则稳住骑手与站点。章末进一步意识到问题可能升级为内部泄密。"
    },
    {
      "character": "老周",
      "change": "从质疑和防备转为公开为陆川背书，愿意以个人信誉压两周执行兑现，帮助稳住站点。"
    },
    {
      "character": "苏蔓",
      "change": "主导把稳人方案落成可追责文本，明确只写能做到的承诺，承担结算流程盯办角色。"
    },
    {
      "character": "何小满",
      "change": "继续提供数据支撑，参与界定罚款复核边界和后台日志支持。"
    },
    {
      "character": "阿凯",
      "change": "从直接质疑是否更稳，转为接受观望两周，不立即离开。"
    },
    {
      "character": "赵姐",
      "change": "从此前只会直接骂平台问题，转为主动向陆川预警竞争对手已开始精准挖商户并疑似掌握内部资料。"
    }
  ],
  "relationship_changes": [
    "陆川与老周的互信明显增强，老周首次在全站点公开替陆川担保。",
    "陆川与站点骑手的关系从单向管理转向以兑现换信任的试运行关系，核心条件是两周内看结果。",
    "苏蔓、何小满与陆川形成围绕‘两周稳人执行表’的临时执行同盟。",
    "赵姐与陆川之间的关系更偏向合作与通风报信，赵姐开始提供关键外部情报。"
  ],
  "foreshadowing_updates": [
    {
      "id": "foreshadowing_confidence_war",
      "status": "new",
      "note": "竞争已从补贴和系统问题升级为信心战，后续骑手、站长、商户是否继续流失取决于两周执行兑现与外界舆论。"
    },
    {
      "id": "foreshadowing_two_week_test",
      "status": "new",
      "note": "老周站点设定了明确的两周观察期，结算、罚款复核、调度修复是否兑现将直接决定人员去留。"
    },
    {
      "id": "foreshadowing_internal_leak",
      "status": "new",
      "note": "闪奔掌握了迅城达内部配送复盘级别信息，暗示公司内部有人向竞争对手泄露资料，后续需查内鬼。"
    },
    {
      "id": "foreshadowing_competitor_expansion",
      "status": "new",
      "note": "闪奔不仅挖骑手，也开始精准挖商户，说明其进攻范围扩大，后续可能进一步冲击迅城达业务基本盘。"
    }
  ],
  "location_or_org_changes": [
    "老周站点暂时稳住，未出现即刻性骨干集体出走，但整体信心仍脆弱。",
    "迅城达针对老周站点启动临时稳人机制，包括按周结、罚款复核、调度优先修复等专项措施。",
    "公司层面的问题被内部公开承认：烂账、系统缺陷、管理层脱离一线仍未彻底解决。",
    "闪奔到家对迅城达的竞争动作从骑手端扩展到商户端，且呈现出情报充分、打法专业的组织化进攻。"
  ],
  "must_remember_next": [
    "老周站点存在明确的两周观察窗口，所有承诺都要看是否按时兑现。",
    "稳人执行表的三大核心承诺：新单按周结、历史欠项时间表、罚款复核入口开放，另有两周内调度优先修片区。",
    "老周已用个人信誉为陆川背书，若陆川失约，老周的立场可能反转并造成更大打击。",
    "骨干骑手和阿凯等人只是暂缓离开，并非真正恢复信任。",
    "赵姐提供的信息表明闪奔掌握内部复盘细节，必须继续追查迅城达内部泄密源头。",
    "闪奔的竞争逻辑是先打信心，再挖骑手和商户，后续外部舆论与内部稳定都会成为关键战场。"
  ]
}