{
  "chapter_index": 19,
  "summary": "董事会专项听证中，陆川在苏蔓、何小满配合下，以订单、时间、赔付和后台日志逐笔举证，证明东岭、北桥、城南异常早于他改规则，核心问题是系统参数长期被人为偏向“好看数据”、高峰阈值被非常规权限修改、赔付链路被异常放大，且商户名单与区域信息疑似外泄。郑维因权限日志、赔付审批和对外挖角时点高度重合，被法务当场冻结权限带走。韩啸虽暂无直接输送证据，但被坐实长期以报表优先压制真实异常。魏岚因此将公司方向从拆卖优先改为继续运营条件评估，并给陆川24小时窗口，要求次日9点前拉起核心商户、关键站点出勤和重点区域履约。",
  "new_facts": [
    "东岭、北桥、城南三片区共57单异常单的爆发时间早于陆川调整奖惩和规则，异常并非由他上任后引发。",
    "系统从三个月前起持续上调“准时签收优先展示”权重、压低附近空闲运力匹配权重，导致难单、远单、雨天单被持续后置。",
    "北桥片区高峰限流阈值在事故前夜被通过运营直通的非常规权限修改，未走站点主管申请和产品复核流程。",
    "东岭站曾三次上报晚高峰接近崩线，但后台备注要求“先保口径稳定，暂不升级”，说明异常被压制。",
    "赔付链路存在重复申诉、异常豁免、关联商户快速通道、绕开二次复核和非工作时段集中处理等异常。",
    "郑维的权限账号在异常赔付审批、异常放行和关键权限周边高频出现，成为重点嫌疑对象。",
    "订单异常、赔付异常、商户名单与区域信息外泄、外部竞争方精准上门之间形成完整时间链。",
    "外部竞争方“闪奔到家”能够精准接触刚发生履约问题的商户和缺人的站点，说明其掌握了内部敏感经营信息。",
    "陆川拿出去年四季度到今年二季度的三次运营例会纪要，证明韩啸主导提高异常上报层级、压缩系统派单失真表述、优先压赔付口径。",
    "董事会当前结论是：陆川此前对履约失真、名单外泄、系统参数被错误使用的判断成立，他不是在无序乱改。",
    "魏岚批准三项临时支持：冻结相关异常权限、站点奖惩按临时止血方案执行且不走原审批链、核心商户赔付协调由总部专项小组直连。",
    "魏岚将公司策略从“拆卖优先”调整为“继续运营的条件评估”，但只给予24小时验证窗口。"
  ],
  "character_state_changes": [
    {
      "character": "陆川",
      "change": "在董事会上成功自证清白并反击管理层指控，获得临时执行授权，但随即背上24小时内证明公司还能跑起来的硬任务。"
    },
    {
      "character": "苏蔓",
      "change": "从法务与材料整合者转为陆川的重要支撑者，推动并案审议，并把业务问题上升为责任链和制度问题。"
    },
    {
      "character": "何小满",
      "change": "在董事会上公开切出系统日志并确认技术侧结论，站到陆川一边提供关键技术证据。"
    },
    {
      "character": "郑维",
      "change": "从流程与时间线掌控者变成核心嫌疑人，被法务介入、交出手机电脑和权限令牌，所有后台、审批及外联权限被冻结。"
    },
    {
      "character": "韩啸",
      "change": "虽暂未被定性为利益输送同谋，但被坐实长期推动报表优先、压制真实异常，责任与威信大幅受损。"
    },
    {
      "character": "魏岚",
      "change": "从倾向资产处置转为给继续运营一次条件性机会，同时以极苛刻指标和时间窗口考验陆川。"
    }
  ],
  "relationship_changes": [
    "陆川与苏蔓的协同进一步强化，形成事实与法务联动的同一阵线。",
    "陆川与何小满建立了公开的技术证据合作关系。",
    "陆川与魏岚从单纯被审视关系，转为“给窗口但必须交结果”的高压合作关系。",
    "陆川与韩啸彻底公开对立，矛盾从管理分歧升级为责任追究。",
    "郑维与董事会、公司管理层的信任关系基本破裂。",
    "董事会对陆川的判断明显转正，对韩啸与既有管理体系的信任下降。"
  ],
  "foreshadowing_updates": [
    {
      "id": "zhengwei_internal_leak_chain",
      "status": "resolved",
      "note": "郑维被初步坐实与异常权限、赔付放大、信息外泄和外部竞争方精准挖角存在高度关联，并被当场冻结权限带走。"
    },
    {
      "id": "hanshao_management_liability",
      "status": "advanced",
      "note": "韩啸暂无直接利益输送证据，但已被明确认定长期以报表优先压制真实异常，为郑维操作提供土壤，后续仍可能被继续追责。"
    },
    {
      "id": "company_sell_or_save",
      "status": "advanced",
      "note": "公司方向从拆卖优先改为继续运营条件评估，但是否真正保住公司取决于陆川24小时内的履约修复结果。"
    },
    {
      "id": "24h_operational_test",
      "status": "new",
      "note": "次日9点前必须看到核心商户订单起量、关键站点出勤恢复、重点区域履约回稳，否则拆卖方案继续推进。"
    }
  ],
  "location_or_org_changes": [
    "董事会已形成阶段性责任链判断，确认公司近期问题并非单纯由陆川乱改造成。",
    "公司内部相关异常权限、后台权限、审批权限和外联权限已启动冻结。",
    "法务正式介入郑维相关事项，并接管其设备与权限令牌。",
    "站点侧奖惩规则获得24小时临时止血授权，不再走原审批链。",
    "总部将成立或启用专项小组，直连核心商户赔付协调，绕开中间转口。",
    "公司整体决策状态从立即拆卖倾向，转入短期运营保卫战。"
  ],
  "must_remember_next": [
    "陆川已经在董事会上洗清“乱改搞崩公司”的核心指控，董事会认可他的判断基本成立。",
    "郑维已被控制并冻结权限，是当前内部泄密、赔付异常和异常权限操作的核心嫌疑人。",
    "韩啸没有被证明直接收钱，但已被钉死在“报表优先、压制异常”的管理责任上。",
    "魏岚只给了24小时窗口，次日9点前要交付三项结果：核心商户订单起量、关键站点出勤恢复、重点区域履约回稳。",
    "若上述结果起不来，拆卖方案仍会推进，公司并未真正脱险。",
    "接下来剧情重点应转向陆川当夜如何调度站点、商户、补贴、首班运力，兑现董事会窗口。"
  ]
}