{
  "chapter_index": 6,
  "summary": "陆川与苏蔓到北桥站核查履约异常，发现站点已近失控：大量订单无人接，商户持续催单，骑手公开拒单。现场证实系统存在严重逆路线、跨区错派，且同一异常单会被记商户补偿、用户赔付和骑手考核扣款，形成把成本层层压到末端的“三次落账”。老周、赵姐等人当面逼问总部责任。陆川意识到公司核心危机不在汇报口径，而在一线对规则彻底失去信任，于是当众承认算法与赔付口径有问题，提出今晚人工卡异常单、争议单现场登记、统一回应商户，并摘下“临时董事长”工牌，承诺亲自跟单和当场算账，以换取站点暂时继续运转。",
  "new_facts": [
    "北桥站出现严重履约危机：二十多单无人接，拒单率上升，站点大厅接近失控。",
    "系统派单存在明显异常：逆路线、跨区回拉、骑手定位与取送点严重错位。",
    "站点已自行用白板手工改线补位，且人工线路与系统派单方向相反。",
    "异常订单的赔付机制存在结构性问题：同一单可同时记商户补偿、用户赔付和骑手考核扣款，形成末端重复承担损失。",
    "客服常以“先履约后申诉”要求骑手先送单，后续责任却仍可能落到骑手和站点。",
    "总部此前将相关问题归类为“执行不到位”，基层认为这是用一线填报表窟窿。",
    "赵姐代表商户明确表示，若继续延误将失去老客并追责平台，今晚只愿意暂时帮忙压一次商户情绪。",
    "陆川当众提出临时处置方案：人工挑出错派单、不让骑手盲接；超时争议单现场登记；商户催单由站点统一回应。",
    "陆川摘下并扔掉“临时董事长”工牌，承诺亲自跟单、看派单、现场核账，接受次日被公开追责。"
  ],
  "character_state_changes": [
    {
      "character": "陆川",
      "change": "从试图用总部数据和口径理解问题，转为彻底站到一线现场，以解决派单与赔付失真为首要任务。"
    },
    {
      "character": "陆川",
      "change": "公开承认总部算法和赔付口径有问题，并以摘工牌的方式放弃单纯领导姿态，改为亲自下场背书。"
    },
    {
      "character": "苏蔓",
      "change": "亲眼见到北桥站现场失控与派单异常，对总部“运力调配整体可控”的报表认知受到冲击，开始记录真实问题。"
    },
    {
      "character": "老周",
      "change": "从公开质问和强烈对抗陆川，转为暂时观望其是否真的下场干活，但仍未真正信任总部。"
    },
    {
      "character": "赵姐",
      "change": "从愤怒追责平台，转为附条件地暂时替站点压一晚商户情绪，明言次日仍会追责。"
    },
    {
      "character": "北桥站骑手群体",
      "change": "对平台规则的信任降到极低，普遍形成“再接就是自己贴钱送”的共识，但因陆川表态而暂时按住情绪。"
    }
  ],
  "relationship_changes": [
    "陆川与北桥站骑手、站点管理层的关系从‘总部来人/出气筒’转为‘承诺一起扛账、一起送单的临时同阵线’，但信任尚未建立。",
    "陆川与老周形成直接对赌式关系：老周允许其用行动证明自己，保留次日公开羞辱其失信的权力。",
    "陆川与赵姐建立临时合作：赵姐负责短暂稳住商户，陆川负责盯送达与赔付账。",
    "苏蔓与陆川在问题判断上更靠近现实一线，不再仅依赖总部标准数据。",
    "总部与基层、商户之间的对立被当场戳穿，矛盾从隐性不满升级为公开问责。"
  ],
  "foreshadowing_updates": [
    {
      "id": "northbridge_dispatch_compensation_crisis",
      "status": "new",
      "note": "北桥站暴露出系统错派与赔付三次落账问题，成为公司更大制度危机的集中爆点。"
    },
    {
      "id": "lucuan_frontline_test_as_chairman",
      "status": "new",
      "note": "陆川摘下工牌、承诺亲自跟单核账，后续将接受站点对其是否兑现承诺的验货。"
    },
    {
      "id": "hq_vs_frontline_trust_breakdown",
      "status": "new",
      "note": "基层已默认规则只会坑自己，修复一线信任将成为公司能否止血的关键主线。"
    },
    {
      "id": "merchant_backlash_escalation",
      "status": "new",
      "note": "商户端耐心接近耗尽，若今晚仍送不到，次日可能出现更强烈集体追责或流失。"
    }
  ],
  "location_or_org_changes": [
    "北桥站进入准爆炸状态，订单堆积、骑手拒接、商户上门追责，已无法按常规站点流程运转。",
    "站点实际调度已部分脱离总部系统，依赖人工白板改线和现场协调。",
    "公司暴露出组织层面的根本矛盾：总部报表口径与一线真实履约、赔付责任严重脱节。",
    "当晚北桥站将临时执行陆川提出的人工筛单、现场登记争议单、统一回复商户的应急机制。"
  ],
  "must_remember_next": [
    "陆川已当众承诺今晚亲自跟单、看派单、核赔付账，不能下一章无故跳过或失约。",
    "北桥站目前只是暂时按住情绪，骑手、老周、赵姐都在观察陆川是否兑现承诺。",
    "核心矛盾已明确：不是单量本身，而是系统乱派、赔付甩责、总部用基层填报表窟窿。",
    "异常错派单、超时争议单、商户催单三类问题是下一章必须继续处理的现场主线。",
    "苏蔓已见证总部数据失真，后续她对总部口径的态度可能变化。",
    "‘规则不是专门拿来坑一线的’成为陆川后续改革或处置的核心目标。"
  ]
}